"carrera","frase"
"Negocios Internacionales","tengo habilidades para gestionar la distribución internacional de productos"
"Negocios Internacionales","me gusta la planificación de estrategias de comercio internacional"
"Negocios Internacionales","soy bueno en el análisis de riesgos operativos en negocios internacionales"
"Negocios Internacionales","me gusta estudiar casos de fracaso en internacionalización de empresas"
"Negocios Internacionales","disfruto resolviendo problemas de aranceles y cuotas"
"Negocios Internacionales","tengo habilidades para gestionar estrategias de mercadeo global"
"Negocios Internacionales","me gusta la expansión de franquicias internacionales"
"Negocios Internacionales","soy experto en la gestión de proyectos de exportación"
"Negocios Internacionales","me gusta estudiar el impacto de la tecnología en el comercio internacional"
"Negocios Internacionales","disfruto negociando contratos de licenciamiento internacional"
"Negocios Internacionales","tengo habilidades para analizar el potencial de mercado en diferentes países"
"Negocios Internacionales","soy bueno en la selección de socios comerciales internacionales"
"Negocios Internacionales","me gusta estudiar la cultura empresarial en el extranjero"
"Negocios Internacionales","disfruto analizando los efectos del cambio climático en el comercio global"
"Negocios Internacionales","tengo habilidades para diseñar estrategias de importación"
"Negocios Internacionales","me gusta la gestión de riesgos sanitarios en negocios internacionales"
"Negocios Internacionales","soy experto en el análisis de barreras comerciales"
"Negocios Internacionales","me gusta estudiar la responsabilidad social empresarial en el contexto global"
"Negocios Internacionales","disfruto evaluando el impacto de políticas económicas globales"
"Negocios Internacionales","tengo habilidades para gestionar proyectos de inversión extranjera"
"Negocios Internacionales","me gusta la planificación estratégica de negocios internacionales"
"Negocios Internacionales","soy bueno en la resolución de problemas de logística internacional"
"Negocios Internacionales","me gusta estudiar los efectos de la globalización en los negocios"
"Negocios Internacionales","disfruto identificando oportunidades de negocio en mercados emergentes"
"Negocios Internacionales","tengo habilidades para gestionar estrategias de exportación"
"Negocios Internacionales","me gusta el análisis de tendencias económicas internacionales"
"Negocios Internacionales","soy experto en la selección de modos de entrada a nuevos mercados"
"Negocios Internacionales","me gusta el comercio internacional"
"Negocios Internacionales","soy experto en estrategias de exportación"
"Negocios Internacionales","me encanta analizar mercados globales"
"Negocios Internacionales","domino el idioma inglés para negocios"
"Negocios Internacionales","puedo identificar oportunidades de inversión"
"Negocios Internacionales","negocio con diferentes culturas"
"Negocios Internacionales","resuelvo problemas logísticos complejos"
"Negocios Internacionales","estoy familiarizado con la cadena de suministro"
"Negocios Internacionales","evalúo riesgos políticos y económicos"
"Negocios Internacionales","me especializo en aduanas y aranceles"
"Negocios Internacionales","analizo tratados internacionales"
"Negocios Internacionales","diseño estrategias de marketing global"
"Negocios Internacionales","me gusta estudiar la economía mundial"
"Negocios Internacionales","entiendo el funcionamiento de los TLC"
"Negocios Internacionales","trabajo con empresas multinacionales"
"Negocios Internacionales","investigo tendencias comerciales"
"Negocios Internacionales","soy bueno negociando acuerdos internacionales"
"Negocios Internacionales","gestiono proyectos internacionales"
"Negocios Internacionales","me atraen los negocios con Asia"
"Negocios Internacionales","tengo habilidades para la diplomacia económica"
"Negocios Internacionales","interpreto indicadores económicos globales"
"Negocios Internacionales","analizo el flujo de capitales internacionales"
"Negocios Internacionales","me especializo en logística internacional"
"Negocios Internacionales","entiendo las regulaciones aduaneras"
"Negocios Internacionales","participo en ferias internacionales"
"Negocios Internacionales","manejo estrategias de arbitraje comercial"
"Negocios Internacionales","me gustan las relaciones internacionales"
"Negocios Internacionales","domino el análisis de riesgos en mercados extranjeros"
"Negocios Internacionales","trabajo en la promoción de exportaciones"
"Negocios Internacionales","me gusta el estudio de tratados comerciales"
"Negocios Internacionales","soy experto en logística de transporte"
"Negocios Internacionales","diseño estrategias para empresas globales"
"Negocios Internacionales","comprendo la política comercial de los países"
"Negocios Internacionales","estudio la competitividad en los mercados internacionales"
"Negocios Internacionales","me atraen las alianzas estratégicas internacionales"
"Negocios Internacionales","trabajo en la intermediación comercial"
"Negocios Internacionales","me gusta el análisis de riesgos financieros internacionales"
"Negocios Internacionales","soy experto en legislación comercial internacional"
"Negocios Internacionales","participo en misiones comerciales"
"Negocios Internacionales","me especializo en logística de exportaciones"
"Negocios Internacionales","evalúo el impacto de los eventos globales en los negocios"
"Negocios Internacionales","soy bueno en el estudio de mercados emergentes"
"Negocios Internacionales","analizo la competitividad internacional de las empresas"
"Negocios Internacionales","trabajo en la promoción de inversiones extranjeras"
"Negocios Internacionales","me gusta el análisis de riesgos políticos en negocios"
"Negocios Internacionales","domino el uso de monedas extranjeras en operaciones comerciales"
"Negocios Internacionales","participo en proyectos de internacionalización de empresas"
"Negocios Internacionales","me gusta el estudio de mercados internacionales"
"Negocios Internacionales","soy experto en estrategias de entrada a nuevos mercados"
"Negocios Internacionales","analizo la geopolítica en las relaciones comerciales"
"Negocios Internacionales","trabajo en el análisis de riesgos de inversión en el extranjero"
"Negocios Internacionales","me gusta el estudio de barreras comerciales"
"Negocios Internacionales","domino la logística inversa en comercio internacional"
"Negocios Internacionales","me especializo en la gestión de aduanas en importaciones"
"Negocios Internacionales","evalúo la viabilidad de proyectos internacionales"
"Negocios Internacionales","soy bueno en el análisis de costos logísticos globales"
"Negocios Internacionales","me gusta el estudio de tratados de libre comercio"
"Negocios Internacionales","soy experto en el análisis de riesgos cambiarios"
"Negocios Internacionales","me gusta el estudio de cadenas de suministro globales"
"Negocios Internacionales","me especializo en la gestión de exportaciones"
"Recursos Humanos","soy bueno identificando talento"
"Recursos Humanos","me gusta la gestión de personal"
"Recursos Humanos","disfruto desarrollando planes de capacitación"
"Recursos Humanos","me gusta resolver conflictos laborales"
"Recursos Humanos","soy experto en reclutamiento y selección"
"Recursos Humanos","trabajo en el análisis de puestos laborales"
"Recursos Humanos","me especializo en evaluaciones de desempeño"
"Recursos Humanos","disfruto fomentando el trabajo en equipo"
"Recursos Humanos","me gusta el desarrollo organizacional"
"Recursos Humanos","domino la administración de nóminas"
"Recursos Humanos","me gusta promover el bienestar laboral"
"Recursos Humanos","trabajo en la retención de talento"
"Recursos Humanos","me especializo en legislación laboral"
"Recursos Humanos","disfruto implementando programas de motivación"
"Recursos Humanos","me gusta el diseño de políticas de RRHH"
"Recursos Humanos","domino la gestión de beneficios para empleados"
"Recursos Humanos","me gusta realizar estudios de clima laboral"
"Recursos Humanos","soy bueno en la resolución de conflictos laborales"
"Recursos Humanos","trabajo en la mejora de la comunicación interna"
"Recursos Humanos","me especializo en la gestión de talento humano"
"Recursos Humanos","disfruto diseñando planes de desarrollo profesional"
"Recursos Humanos","me gusta el análisis de perfiles laborales"
"Recursos Humanos","domino la administración de personal"
"Recursos Humanos","me gusta fomentar la igualdad de oportunidades"
"Recursos Humanos","trabajo en el diseño de planes de sucesión"
"Recursos Humanos","soy bueno en la resolución de conflictos laborales"
"Recursos Humanos","me especializo en la gestión de compensaciones"
"Recursos Humanos","disfruto realizando entrevistas de trabajo"
"Recursos Humanos","me gusta el desarrollo de talento interno"
"Recursos Humanos","domino la gestión de recursos humanos"
"Recursos Humanos","me gusta implementar programas de bienestar"
"Recursos Humanos","trabajo en el análisis de clima organizacional"
"Recursos Humanos","soy bueno en la selección de personal"
"Recursos Humanos","me especializo en la gestión de relaciones laborales"
"Recursos Humanos","disfruto diseñando planes de formación"
"Recursos Humanos","me gusta el desarrollo de liderazgo"
"Recursos Humanos","domino la gestión de compensaciones y beneficios"
"Recursos Humanos","me gusta realizar evaluaciones de desempeño"
"Recursos Humanos","trabajo en la implementación de políticas de RRHH"
"Recursos Humanos","soy bueno en el manejo de conflictos laborales"
"Recursos Humanos","me especializo en la gestión de talento"
"Recursos Humanos","disfruto promoviendo el trabajo en equipo"
"Recursos Humanos","me gusta el desarrollo organizacional"
"Recursos Humanos","domino la administración de personal"
"Recursos Humanos","me gusta mejorar la comunicación interna"
"Recursos Humanos","trabajo en la retención de talento"
"Recursos Humanos","soy bueno en la resolución de conflictos laborales"
"Recursos Humanos","me especializo en legislación laboral"
"Recursos Humanos","disfruto implementando programas de motivación"
"Recursos Humanos","me gusta el diseño de políticas de RRHH"
"Recursos Humanos","domino la gestión de beneficios para empleados"
"Recursos Humanos","me gusta realizar estudios de clima laboral"
"Recursos Humanos","trabajo en la mejora de la comunicación interna"
"Recursos Humanos","soy bueno en la gestión de talento humano"
"Recursos Humanos","me especializo en el desarrollo profesional"
"Recursos Humanos","disfruto analizando perfiles laborales"
"Recursos Humanos","me gusta la administración de personal"
"Recursos Humanos","domino la igualdad de oportunidades laborales"
"Recursos Humanos","me gusta diseñar planes de sucesión"
"Recursos Humanos","trabajo en la resolución de conflictos laborales"
"Recursos Humanos","soy bueno en la gestión de compensaciones"
"Recursos Humanos","me especializo en la selección de personal"
"Recursos Humanos","disfruto realizando entrevistas laborales"
"Recursos Humanos","me gusta el desarrollo de talento interno"
"Recursos Humanos","domino la gestión de recursos humanos"
"Recursos Humanos","me gusta implementar programas de bienestar laboral"
"Recursos Humanos","trabajo en el análisis de clima organizacional"
"Recursos Humanos","soy bueno en la gestión del talento humano"
"Recursos Humanos","me especializo en la gestión de relaciones laborales"
"Recursos Humanos","disfruto diseñando planes de formación"
"Recursos Humanos","me gusta el desarrollo de liderazgo"
"Recursos Humanos","domino la gestión de compensaciones y beneficios"
"Recursos Humanos","me gusta realizar evaluaciones de desempeño"
"Recursos Humanos","trabajo en la implementación de políticas de RRHH"
"Recursos Humanos","soy bueno en el manejo de conflictos laborales"
"Recursos Humanos","me especializo en la gestión del talento"
"Recursos Humanos","disfruto promoviendo el trabajo en equipo"
"Recursos Humanos","me gusta el desarrollo organizacional"
"Recursos Humanos","domino la administración de personal"
"Recursos Humanos","me gusta mejorar la comunicación interna"
"Recursos Humanos","trabajo en la retención de talento"
"Recursos Humanos","soy bueno en la resolución de conflictos laborales"
"Recursos Humanos","me especializo en legislación laboral"
"Recursos Humanos","disfruto implementando programas de motivación"
"Recursos Humanos","me gusta el diseño de políticas de RRHH"
"Recursos Humanos","domino la gestión de beneficios para empleados"
"Recursos Humanos","me gusta realizar estudios de clima laboral"
"Recursos Humanos","trabajo en la mejora de la comunicación interna"
"Recursos Humanos","soy bueno en la gestión de talento humano"
"Recursos Humanos","me especializo en el desarrollo profesional"
"Recursos Humanos","disfruto analizando perfiles laborales"
"Recursos Humanos","me gusta la administración de personal"
"Recursos Humanos","domino la igualdad de oportunidades laborales"
"Recursos Humanos","me gusta diseñar planes de sucesión"
"Recursos Humanos","trabajo en la resolución de conflictos laborales"
"Recursos Humanos","soy bueno en la gestión de compensaciones"
"Recursos Humanos","me especializo en la selección de personal"
"Recursos Humanos","disfruto realizando entrevistas laborales"
"Recursos Humanos","me gusta el desarrollo de talento interno"
"Recursos Humanos","domino la gestión de recursos humanos"
"Recursos Humanos","me gusta implementar programas de bienestar laboral"
"Recursos Humanos","trabajo en el análisis de clima organizacional"
"Recursos Humanos","soy bueno en el manejo de conflictos laborales"
"Recursos Humanos","me especializo en la gestión del talento"
"Recursos Humanos","disfruto promoviendo el trabajo en equipo"
"Recursos Humanos","me gusta el desarrollo organizacional"
"Recursos Humanos","domino la administración de personal"
"Recursos Humanos","me gusta mejorar la comunicación interna"
"Recursos Humanos","trabajo en la retención de talento"
"Recursos Humanos","soy bueno en la resolución de conflictos laborales"
"Recursos Humanos","me especializo en legislación laboral"
"Recursos Humanos","disfruto implementando programas de motivación"
"Recursos Humanos","me gusta el diseño de políticas de RRHH"
"Recursos Humanos","domino la gestión de beneficios para empleados"
"Recursos Humanos","me gusta realizar estudios de clima laboral"
"Recursos Humanos","trabajo en la mejora de la comunicación interna"
"Recursos Humanos","soy bueno en la gestión de talento humano"
"Recursos Humanos","me especializo en el desarrollo profesional"
"Recursos Humanos","disfruto analizando perfiles laborales"
"Recursos Humanos","me gusta la administración de personal"
"Recursos Humanos","domino la igualdad de oportunidades laborales"
"Recursos Humanos","me gusta diseñar planes de sucesión"
"Recursos Humanos","trabajo en la resolución de conflictos laborales"
"Recursos Humanos","soy bueno en la gestión de compensaciones"
"Recursos Humanos","me especializo en la selección de personal"
"Recursos Humanos","disfruto realizando entrevistas laborales"
"Recursos Humanos","me gusta el desarrollo de talento interno"
"Recursos Humanos","domino la gestión de recursos humanos"
"Recursos Humanos","me gusta implementar programas de bienestar laboral"
"Recursos Humanos","trabajo en el análisis de clima organizacional"
"Recursos Humanos","soy bueno en el manejo de conflictos laborales"
"Recursos Humanos","me especializo en la gestión del talento"
"Recursos Humanos","disfruto promoviendo el trabajo en equipo"
"Recursos Humanos","me gusta el desarrollo organizacional"
"Recursos Humanos","domino la administración de personal"
"Recursos Humanos","me gusta mejorar la comunicación interna"
"Recursos Humanos","trabajo en la retención de talento"
"Recursos Humanos","soy bueno en la resolución de conflictos laborales"
"Recursos Humanos","me especializo en legislación laboral"
"Recursos Humanos","disfruto implementando programas de motivación"
"Recursos Humanos","me gusta el diseño de políticas de RRHH"
"Recursos Humanos","domino la gestión de beneficios para empleados"
"Recursos Humanos","me gusta realizar estudios de clima laboral"
"Recursos Humanos","trabajo en la mejora de la comunicación interna"
"Recursos Humanos","soy bueno en la gestión de talento humano"
"Mercadotecnia","me gusta analizar tendencias de consumo"
"Mercadotecnia","soy experto en estrategias de marketing"
"Mercadotecnia","disfruto diseñando campañas publicitarias"
"Mercadotecnia","me gusta el estudio de mercados"
"Mercadotecnia","domino el análisis de competencia"
"Mercadotecnia","trabajo en la creación de marcas impactantes"
"Mercadotecnia","me especializo en el marketing digital"
"Mercadotecnia","me gusta investigar comportamientos del consumidor"
"Mercadotecnia","soy bueno en el desarrollo de productos"
"Mercadotecnia","disfruto haciendo análisis de precios"
"Mercadotecnia","me gusta el estudio de segmentación de mercado"
"Mercadotecnia","trabajo en la identificación de oportunidades comerciales"
"Mercadotecnia","me gusta realizar estudios de mercado"
"Mercadotecnia","soy experto en técnicas de branding"
"Mercadotecnia","domino el marketing estratégico"
"Mercadotecnia","disfruto diseñando estrategias promocionales"
"Mercadotecnia","me gusta la investigación de mercado"
"Mercadotecnia","trabajo en la planificación de lanzamientos de productos"
"Mercadotecnia","me gusta realizar análisis de satisfacción del cliente"
"Mercadotecnia","soy bueno en el desarrollo de estrategias de ventas"
"Mercadotecnia","disfruto analizando datos de mercado"
"Mercadotecnia","me gusta el marketing relacional"
"Mercadotecnia","domino el marketing de contenidos"
"Mercadotecnia","trabajo en la gestión de redes sociales"
"Mercadotecnia","me gusta investigar nuevos nichos de mercado"
"Mercadotecnia","soy experto en el análisis de datos demográficos"
"Mercadotecnia","disfruto creando estrategias de comunicación"
"Mercadotecnia","me gusta el marketing directo"
"Mercadotecnia","trabajo en la implementación de planes de publicidad"
"Mercadotecnia","me gusta realizar estudios de comportamiento del consumidor"
"Mercadotecnia","soy bueno en la creación de mensajes publicitarios"
"Mercadotecnia","disfruto diseñando estrategias de posicionamiento de marca"
"Mercadotecnia","me gusta la investigación de mercados internacionales"
"Mercadotecnia","domino el análisis de resultados de campañas publicitarias"
"Mercadotecnia","trabajo en la gestión de proyectos de marketing"
"Mercadotecnia","me gusta realizar análisis de percepción de marca"
"Mercadotecnia","soy experto en el desarrollo de estrategias de promoción"
"Mercadotecnia","disfruto analizando datos de tendencias de consumo"
"Mercadotecnia","me gusta el marketing experiencial"
"Mercadotecnia","trabajo en la implementación de estrategias de email marketing"
"Mercadotecnia","me gusta investigar la competencia en línea"
"Mercadotecnia","soy bueno en el diseño de campañas de publicidad digital"
"Mercadotecnia","disfruto creando estrategias de marketing de contenidos"
"Mercadotecnia","me gusta el análisis de resultados en redes sociales"
"Mercadotecnia","domino el marketing de influencia"
"Mercadotecnia","trabajo en la optimización de campañas publicitarias en línea"
"Mercadotecnia","me gusta realizar estudios de mercado en línea"
"Mercadotecnia","soy experto en el desarrollo de estrategias de posicionamiento web"
"Mercadotecnia","disfruto analizando el rendimiento de campañas de email marketing"
"Mercadotecnia","me gusta el marketing digital móvil"
"Mercadotecnia","trabajo en la implementación de estrategias de marketing de influencers"
"Mercadotecnia","me gusta investigar nuevas herramientas de marketing en línea"
"Mercadotecnia","soy bueno en el diseño de estrategias de content marketing"
"Mercadotecnia","disfruto creando campañas publicitarias efectivas en redes sociales"
"Mercadotecnia","me gusta el análisis de datos en marketing digital"
"Mercadotecnia","domino el marketing de afiliados"
"Mercadotecnia","trabajo en la optimización de campañas publicitarias en buscadores"
"Mercadotecnia","me gusta realizar estudios de mercado en línea"
"Mercadotecnia","soy experto en el desarrollo de estrategias de posicionamiento web"
"Mercadotecnia","disfruto analizando el rendimiento de campañas de email marketing"
"Mercadotecnia","me gusta el marketing digital móvil"
"Mercadotecnia","trabajo en la implementación de estrategias de marketing de influencers"
"Mercadotecnia","me gusta investigar nuevas herramientas de marketing en línea"
"Mercadotecnia","soy bueno en el diseño de estrategias de content marketing"
"Mercadotecnia","disfruto creando campañas publicitarias efectivas en redes sociales"
"Mercadotecnia","me gusta el análisis de datos en marketing digital"
"Mercadotecnia","domino el marketing de afiliados"
"Mercadotecnia","trabajo en la optimización de campañas publicitarias en buscadores"
"Mercadotecnia","me gusta realizar análisis de conversiones en sitios web"
"Mercadotecnia","soy experto en el desarrollo de estrategias de email marketing"
"Mercadotecnia","disfruto analizando el comportamiento del consumidor en línea"
"Mercadotecnia","me gusta el marketing de contenido para redes sociales"
"Mercadotecnia","trabajo en la gestión de campañas de marketing en línea"
"Mercadotecnia","me gusta investigar las últimas tendencias en marketing digital"
"Mercadotecnia","soy bueno en el diseño de estrategias de posicionamiento en buscadores"
"Mercadotecnia","disfruto creando contenido viral para redes sociales"
"Mercadotecnia","me gusta el análisis de métricas de marketing en línea"
"Mercadotecnia","domino el marketing de contenido para blogs y sitios web"
"Mercadotecnia","trabajo en la implementación de estrategias de marketing digital móvil"
"Mercadotecnia","me gusta investigar la efectividad de anuncios en línea"
"Mercadotecnia","soy experto en el desarrollo de campañas de email marketing"
"Mercadotecnia","disfruto analizando el rendimiento de anuncios en redes sociales"
"Mercadotecnia","me gusta el marketing de contenidos interactivos"
"Mercadotecnia","trabajo en la gestión de campañas de publicidad en buscadores"
"Mercadotecnia","me gusta investigar estrategias de remarketing en línea"
"Mercadotecnia","soy bueno en el diseño de estrategias de marketing de contenidos para SEO"
"Mercadotecnia","disfruto creando campañas de promoción en redes sociales"
"Mercadotecnia","domino el marketing de contenidos para video marketing"
"Mercadotecnia","me gusta investigar el impacto de campañas de email marketing"
"Mercadotecnia","soy experto en el desarrollo de estrategias de marketing de influencers"
"Mercadotecnia","disfruto analizando la efectividad de campañas de publicidad en línea"
"Mercadotecnia","me gusta el marketing de contenidos para experiencias de realidad virtual"
"Mercadotecnia","trabajo en la gestión de campañas de publicidad nativa en línea"
"Mercadotecnia","me gusta investigar la influencia de los microinfluencers en redes sociales"
"Mercadotecnia","soy bueno en el diseño de estrategias de marketing omnicanal"
"Mercadotecnia","disfruto creando campañas de email marketing personalizadas"
"Mercadotecnia","me gusta el análisis de datos de consumidores en línea"
"Mercadotecnia","domino el marketing de contenidos para campañas de gamificación"
"Mercadotecnia","trabajo en la implementación de estrategias de marketing en dispositivos móviles"
"Mercadotecnia","me gusta investigar el impacto de campañas de publicidad en redes sociales"
"Mercadotecnia","soy experto en el desarrollo de estrategias de marketing de contenido para SEO"
"Mercadotecnia","disfruto analizando la efectividad de campañas de video marketing"
"Mercadotecnia","me gusta el marketing de contenidos para experiencias de realidad aumentada"
"Mercadotecnia","trabajo en la gestión de campañas de publicidad programática en línea"
"Mercadotecnia","soy bueno en el diseño de estrategias de marketing para comercio electrónico"
"Mercadotecnia","disfruto creando campañas de marketing de contenidos para redes sociales"
"Mercadotecnia","me gusta el análisis de datos en tiempo real para marketing digital"
"Mercadotecnia","domino el marketing de contenidos para publicidad en dispositivos móviles"
"Mercadotecnia","trabajo en la implementación de estrategias de marketing de influencers en video"
"Mercadotecnia","me gusta investigar el alcance de campañas de publicidad en buscadores"
"Mercadotecnia","soy experto en el desarrollo de estrategias de email marketing automatizado"
"Mercadotecnia","me gusta el marketing de contenidos para eventos en línea"
"Mercadotecnia","trabajo en la gestión de campañas de publicidad en redes sociales"
"Mercadotecnia","me gusta investigar el impacto de campañas de email marketing segmentadas"
"Mercadotecnia","soy bueno en el diseño de estrategias de marketing para aplicaciones móviles"
"Mercadotecnia","disfruto creando campañas de video marketing para plataformas digitales"
"Mercadotecnia","domino el marketing de contenidos para estrategias de marketing B2B"
