"carrera","frase"
"Sin Area","No lo sé"
"Sin Area","No tengo idea"
"Sin Area","No estoy seguro"
"Sin Area","No podría decirte"
"Sin Area","No recuerdo eso"
"Sin Area","No me acuerdo"
"Sin Area","No tengo ni idea"
"Sin Area","No sabría decirte"
"Sin Area","No estoy convencido"
"Sin Area","No estoy seguro de eso"
"Sin Area","No tengo la menor idea"
"Sin Area","No me siento capacitado"
"Sin Area","No creo que pueda hacerlo"
"Sin Area","No tengo la experiencia necesaria"
"Sin Area","No cuento con las habilidades"
"Sin Area","No sé cómo responder"
"Sin Area","No puedo decidirme"
"Sin Area","No tengo conocimientos sobre eso"
"Sin Area","No me siento competente"
"Sin Area","No tengo la capacidad para eso"
"Sin Area","No tengo la información suficiente"
"Sin Area","No puedo determinar una respuesta"
"Sin Area","No me veo capaz de hacerlo"
"Sin Area","No tengo la formación necesaria"
"Sin Area","No estoy capacitado para responder"
"Sin Area","No creo tener la habilidad requerida"
"Sin Area","No tengo la certeza necesaria"
"Sin Area","No puedo hacerlo por el momento"
"Sin Area","No tengo los conocimientos necesarios"
"Sin Area","No siento que pueda hacerlo"
"Sin Area","No tengo la confianza suficiente"
"Sin Area","No puedo dar una respuesta clara"
"Sin Area","No tengo la habilidad para eso"
"Sin Area","No tengo una respuesta definitiva"
"Sin Area","No puedo responder adecuadamente"
"Sin Area","No tengo la competencia necesaria"
"Sin Area","No puedo llegar a una conclusión"
"Sin Area","No tengo suficiente información"
"Sin Area","No tengo la aptitud requerida"
"Sin Area","No puedo tomar una decisión ahora"
"Sin Area","No tengo los recursos necesarios"
"Sin Area","No me siento capaz de hacerlo"
"Sin Area","No tengo la experiencia suficiente"
"Sin Area","No puedo afirmar nada con certeza"
"Sin Area","No tengo la capacidad para responder"
"Sin Area","No sé si pueda hacerlo"
"Sin Area","No estoy seguro de mis habilidades"
"Sin Area","No tengo el conocimiento adecuado"
"Sin Area","No puedo decirte con exactitud"
"Sin Area","No tengo suficiente confianza"
"Sin Area","No puedo dar una respuesta precisa"
"Sin Area","No sé qué debería hacer"
"Sin Area","No tengo los medios para hacerlo"
"Sin Area","No tengo la experiencia requerida"
"Sin Area","No puedo tomar una decisión clara"
"Sin Area","No tengo las habilidades necesarias"
"Sin Area","No puedo recordar la información"
"Sin Area","No sé si soy capaz de hacerlo"
"Sin Area","No tengo la seguridad necesaria"
"Sin Area","No puedo determinar si es posible"
"Sin Area","No tengo la destreza requerida"
"Sin Area","No sé si puedo lograrlo"
"Sin Area","No tengo la respuesta correcta"
"Sin Area","No puedo responder de manera adecuada"
"Sin Area","No sé qué camino tomar"
"Sin Area","No tengo la competencia suficiente"
"Sin Area","No puedo afirmar nada al respecto"
"Sin Area","No sé si es posible hacerlo"
"Sin Area","No tengo la habilidad necesaria"
"Sin Area","No puedo dar una respuesta definitiva"
"Sin Area","No sé qué debería decir"
"Sin Area","No tengo la preparación necesaria"
"Sin Area","No puedo tomar una decisión ahora mismo"
"Sin Area","No tengo suficiente información para decidir"
"Sin Area","No sé si soy capaz de hacerlo bien"
"Sin Area","No tengo la certeza de mi respuesta"
"Sin Area","No puedo decirte con certeza absoluta"
"Sin Area","No sé si puedo hacerlo correctamente"
"Sin Area","No tengo la suficiente confianza en mi respuesta"
"Sin Area","No puedo recordar exactamente la información"
"Sin Area","No sé si tengo las habilidades requeridas"
"Sin Area","No tengo la experiencia o conocimientos necesarios"
"Sin Area","No puedo tomar una decisión con seguridad"
"Sin Area","No sé si es viable llevarlo a cabo"
"Sin Area","No tengo la capacidad para responder adecuadamente"
"Sin Area","No puedo dar una respuesta precisa en este momento"
"Sin Area","No sé qué camino seguir para resolverlo"
"Sin Area","No tengo la competencia o aptitud necesaria"
"Sin Area","No puedo afirmar con total seguridad"
"Sin Area","No sé si seré capaz de hacerlo correctamente"
"Sin Area","No tengo la seguridad de poder lograrlo"
"Sin Area","No puedo determinar si es la opción correcta"
"Sin Area","No sé si puedo lograrlo con éxito"
"Sin Area","No tengo la respuesta definitiva que buscas"
"Sin Area","No puedo responder de manera precisa"
"Sin Area","No sé qué decir en este caso"
"Sin Area","No tengo la preparación o experiencia necesaria"
"Sin Area","No puedo tomar una decisión en este momento"
"Sin Area","No tengo suficiente información para dar una respuesta"
"Sin Area","No sé si seré capaz de hacerlo bien"
"Sin Area","No tengo la certeza absoluta de mi respuesta"
"Sin Area","No puedo decirte con total certeza"
"Sin Area","No sé si puedo hacerlo de manera correcta"
"Sin Area","No tengo la confianza suficiente en mi respuesta"
"Sin Area","No puedo recordar toda la información necesaria"
"Sin Area","No sé si tengo las habilidades suficientes"
"Sin Area","No tengo la experiencia o conocimientos suficientes"
"Sin Area","No puedo tomar una decisión con total seguridad"
"Sin Area","No sé si es posible realizarlo"
"Sin Area","No tengo la capacidad para responder en este momento"
"Sin Area","No puedo dar una respuesta precisa ahora"
"Sin Area","No sé qué camino tomar para solucionarlo"
"Sin Area","No tengo la competencia o aptitud requerida"
"Sin Area","No puedo afirmar con total certeza"
"Sin Area","No sé si podré hacerlo correctamente"
"Sin Area","No tengo la seguridad de poder lograrlo con éxito"
"Sin Area","No puedo determinar si es la mejor opción"
"Sin Area","No sé si puedo lograrlo de manera exitosa"
"Sin Area","No tengo la respuesta definitiva que estás buscando"
"Sin Area","No puedo responder de manera exacta"
"Sin Area","No sé qué decir en esta situación"
"Sin Area","No tengo la preparación o experiencia suficiente"
"Sin Area","No puedo tomar una decisión definitiva en este momento"
"Sin Area","No tengo suficiente información para responder con certeza"
"Sin Area","No sé si seré capaz de hacerlo correctamente"
"Sin Area","No tengo la certeza absoluta de mi respuesta en este caso"
"Sin Area","No puedo decirte con total certeza absoluta"
"Sin Area","No sé si puedo hacerlo de manera adecuada"
"Sin Area","No tengo la confianza suficiente en mi respuesta actual"
"Sin Area","No puedo recordar todos los detalles necesarios"
"Sin Area","No sé si tengo las habilidades requeridas para hacerlo"
"Sin Area","No tengo la experiencia o conocimientos suficientes para resolverlo"
"Sin Area","No puedo tomar una decisión con total seguridad en este momento"
"Sin Area","No sé si es posible llevar a cabo esta acción"
"Sin Area","No tengo la capacidad para responder adecuadamente en este instante"
"Sin Area","No puedo dar una respuesta precisa en este momento"
"Sin Area","No sé qué camino seguir para solucionar esta cuestión"
"Sin Area","No tengo la competencia o aptitud requerida para responder"
"Sin Area","No puedo afirmar con total certeza en este momento"
"Sin Area","No sé si podré hacerlo de manera correcta"
"Sin Area","No tengo la seguridad de poder lograrlo con éxito en esta situación"
"Sin Area","No puedo determinar si es la opción más acertada"
"Sin Area","No sé si puedo lograrlo de manera exitosa en este caso"
"Sin Area","No tengo la respuesta definitiva que buscas en este momento"
"Sin Area","No puedo responder de manera exacta ahora mismo"
"Sin Area","No sé qué decir en esta ocasión"
"Sin Area","No tengo la preparación o experiencia necesaria para esto"
"Sin Area","No puedo tomar una decisión definitiva ahora mismo"
"Sin Area","No tengo suficiente información para responder con certeza absoluta"
"Sin Area","No sé si seré capaz de hacerlo correctamente en esta circunstancia"
"Sin Area","No tengo la certeza absoluta de mi respuesta en esta situación"
"Sin Area","No puedo decirte con total certeza absoluta en este caso"
"Sin Area","No sé si puedo hacerlo de manera adecuada en este contexto"
"Sin Area","No tengo la confianza suficiente en mi respuesta actualmente"
"Sin Area","No puedo recordar todos los detalles necesarios en este momento"
"Sin Area","No sé si tengo las habilidades requeridas para hacerlo bien"
"Sin Area","No puedo tomar una decisión con total seguridad en este instante"
"Sin Area","No sé si es posible llevar a cabo esta acción de manera efectiva"
"Sin Area","No tengo la capacidad para responder adecuadamente en este instante"
"Sin Area","No puedo dar una respuesta precisa ahora mismo"
"Sin Area","No puedo afirmar con total certeza en este momento"
"Sin Area","No sé si podré hacerlo de manera correcta en este caso"
"Sin Area","No puedo determinar si es la opción más acertada en este momento"
"Sin Area","No sé si puedo lograrlo de manera exitosa en esta ocasión"
"Sin Area","No tengo la respuesta definitiva que buscas en este instante"
"Sin Area","No puedo responder de manera exacta en este momento"
"Sin Area","No sé qué decir en esta situación particular"
"Sin Area","No tengo la preparación o experiencia necesaria para esto ahora"
"Sin Area","No puedo tomar una decisión definitiva en este momento preciso"
"Sin Area","No puedo dar una respuesta precisa ahora mismo en este caso"
"Sin Area","No puedo afirmar con total certeza en este momento específico"
"Sin Area","No puedo responder de manera exacta en este momento específico"
"Sin Area","No sé qué decir en esta situación particular actual"
"Administración","soy bueno organizando equipos de trabajo"
"Administración","me encanta analizar datos financieros"
"Administración","disfruto resolviendo problemas empresariales"
"Administración","tengo habilidades para planificar estrategias"
"Administración","me gusta liderar proyectos ambiciosos"
"Administración","soy experto en administrar recursos"
"Administración","me gusta mejorar la eficiencia operativa"
"Administración","disfruto tomando decisiones importantes"
"Administración","tengo habilidades para negociar acuerdos"
"Administración","me siento cómodo dando presentaciones ejecutivas"
"Administración","me gusta identificar oportunidades de crecimiento"
"Administración","disfruto analizando el mercado competitivo"
"Administración","tengo habilidades para gestionar proyectos complejos"
"Administración","me gusta la innovación empresarial"
"Administración","me siento realizado al alcanzar objetivos organizacionales"
"Administración","disfruto mejorando procesos administrativos"
"Administración","tengo habilidades para motivar equipos de trabajo"
"Administración","me gusta diseñar planes de negocio"
"Administración","soy bueno en el análisis financiero"
"Administración","me gusta el emprendimiento"
"Administración","disfruto estableciendo metas y objetivos claros"
"Administración","tengo habilidades para resolver conflictos laborales"
"Administración","me gusta evaluar estrategias de marketing"
"Administración","soy experto en planificación estratégica"
"Administración","me encanta mejorar la productividad empresarial"
"Administración","disfruto optimizando la cadena de suministro"
"Administración","tengo habilidades para gestionar recursos humanos"
"Administración","me gusta diseñar modelos de negocios innovadores"
"Administración","soy bueno en el análisis de costos y presupuestos"
"Administración","me gusta el desarrollo organizacional"
"Administración","disfruto implementando soluciones empresariales"
"Administración","tengo habilidades para liderar cambios organizacionales"
"Administración","me gusta estudiar tendencias económicas"
"Administración","soy experto en gestión de proyectos"
"Administración","me encanta investigar mercados internacionales"
"Administración","disfruto diseñando estrategias de ventas"
"Administración","tengo habilidades para resolver problemas financieros"
"Administración","me gusta evaluar riesgos empresariales"
"Administración","soy bueno en la toma de decisiones estratégicas"
"Administración","me gusta el análisis de inversiones"
"Administración","disfruto desarrollando habilidades de liderazgo"
"Administración","tengo habilidades para gestionar proyectos de emprendimiento"
"Administración","me gusta innovar en la gestión organizacional"
"Administración","soy experto en la optimización de procesos administrativos"
"Administración","me encanta investigar el comportamiento del consumidor"
"Administración","disfruto diseñando planes estratégicos"
"Administración","tengo habilidades para analizar estados financieros"
"Administración","me gusta emprender nuevos negocios"
"Administración","soy bueno en el análisis de viabilidad de proyectos"
"Administración","me gusta la gestión de recursos humanos"
"Administración","disfruto evaluando el impacto de decisiones empresariales"
"Administración","tengo habilidades para liderar equipos de trabajo"
"Administración","me gusta diseñar estrategias de expansión"
"Administración","soy experto en el análisis de mercado"
"Administración","me encanta mejorar la eficacia organizacional"
"Administración","disfruto desarrollando planes de negocios innovadores"
"Administración","tengo habilidades para resolver problemas de logística"
"Administración","me gusta estudiar la economía global"
"Administración","soy bueno en la gestión de proyectos de inversión"
"Administración","me gusta la gestión financiera"
"Administración","disfruto diseñando estrategias de marketing digital"
"Administración","tengo habilidades para liderar proyectos de emprendimiento social"
"Administración","me gusta analizar indicadores de desempeño empresarial"
"Administración","soy experto en la gestión de recursos financieros"
"Administración","me encanta la innovación en modelos de negocio"
"Administración","disfruto optimizando procesos de producción"
"Administración","tengo habilidades para motivar equipos de trabajo"
"Administración","me gusta desarrollar habilidades de negociación"
"Administración","soy bueno en el análisis de la competencia"
"Administración","me gusta la gestión de la cadena de suministro"
"Administración","disfruto identificando oportunidades de crecimiento empresarial"
"Administración","tengo habilidades para tomar decisiones estratégicas"
"Administración","me gusta liderar proyectos de innovación"
"Administración","soy experto en el análisis de datos financieros"
"Administración","me encanta mejorar la eficiencia operativa"
"Administración","disfruto resolviendo problemas empresariales"
"Administración","tengo habilidades para gestionar proyectos complejos"
"Administración","me gusta diseñar estrategias de crecimiento"
"Administración","soy experto en la evaluación de riesgos empresariales"
"Administración","me encanta el análisis de viabilidad de negocios"
"Administración","disfruto diseñando planes de inversión"
"Administración","tengo habilidades para liderar cambios organizacionales"
"Administración","me gusta evaluar estrategias de marketing"
"Administración","soy bueno en la planificación estratégica"
"Administración","me gusta la gestión de proyectos de emprendimiento"
"Administración","disfruto resolviendo problemas logísticos"
"Administración","tengo habilidades para negociar acuerdos empresariales"
"Administración","me gusta estudiar tendencias económicas"
"Administración","soy experto en la gestión de recursos humanos"
"Administración","me encanta el análisis financiero"
"Administración","disfruto optimizando la cadena de suministro"
"Administración","tengo habilidades para liderar equipos de trabajo"
"Administración","me gusta diseñar modelos de negocios innovadores"
"Administración","soy bueno en el análisis de costos y presupuestos"
"Administración","me gusta el desarrollo organizacional"
"Administración","disfruto implementando soluciones empresariales"
"Administración","me gusta analizar indicadores de desempeño"
"Administración","soy experto en la gestión de recursos financieros"
"Administración","me encanta innovar en modelos de negocio"
"Administración","disfruto optimizando procesos de producción"
"Administración","tengo habilidades para motivar equipos de trabajo"
"Administración","me gusta desarrollar habilidades de negociación"
"Administración","soy bueno en el análisis de la competencia"
"Administración","me gusta la gestión de la cadena de suministro"
"Administración","disfruto identificando oportunidades de crecimiento"
"Administración","tengo habilidades para tomar decisiones estratégicas"
"Administración","me gusta liderar proyectos de innovación"
"Administración","soy experto en el análisis de datos financieros"
"Administración","me encanta mejorar la eficiencia operativa"
"Administración","me gusta liderar equipos de trabajo"
"Administración","soy experto en planificación estratégica"
"Administración","disfruto analizando indicadores financieros"
"Administración","me gusta la gestión de proyectos"
"Administración","domino la administración de recursos"
"Administración","trabajo en la optimización de procesos"
"Administración","me gusta tomar decisiones estratégicas"
"Administración","soy bueno en la resolución de problemas empresariales"
"Administración","disfruto coordinando actividades comerciales"
"Administración","me gusta el análisis de mercado"
"Administración","domino la contabilidad financiera"
"Administración","trabajo en la implementación de políticas organizacionales"
"Administración","me gusta realizar estudios de viabilidad económica"
"Administración","soy experto en el desarrollo de estrategias de negocio"
"Administración","disfruto gestionando el talento humano"
"Administración","me gusta la administración de empresas"
"Administración","domino la dirección de proyectos empresariales"
"Administración","trabajo en la planificación financiera"
"Administración","me gusta analizar informes de gestión"
"Administración","soy bueno en la toma de decisiones financieras"
"Administración","disfruto liderando equipos multidisciplinarios"
"Administración","me gusta el análisis de riesgos empresariales"
"Administración","domino la gestión de operaciones"
"Administración","trabajo en la creación de estrategias de marketing"
"Administración","me gusta optimizar los recursos financieros"
"Administración","soy experto en el diseño de estructuras organizativas"
"Administración","disfruto coordinando proyectos empresariales"
"Administración","me gusta el análisis de costos"
"Administración","domino la gestión de la cadena de suministro"
"Administración","trabajo en la dirección de empresas"
"Administración","me gusta evaluar la rentabilidad de inversiones"
"Administración","soy bueno en el desarrollo de estrategias de recursos humanos"
"Administración","disfruto gestionando el presupuesto empresarial"
"Administración","me gusta el análisis de datos financieros"
"Administración","domino la planificación estratégica de proyectos"
"Administración","trabajo en la optimización de la cadena de suministro"
"Administración","me gusta liderar equipos interdisciplinarios"
"Administración","soy experto en el análisis de estados financieros"
"Administración","disfruto coordinando estrategias de marketing"
"Administración","me gusta la gestión de proyectos empresariales"
"Administración","domino la gestión de recursos financieros"
"Administración","trabajo en la toma de decisiones estratégicas"
"Administración","me gusta desarrollar planes de negocios"
"Administración","soy bueno en la evaluación de riesgos empresariales"
"Administración","disfruto coordinando actividades administrativas"
"Administración","me gusta el análisis de indicadores de gestión"
"Administración","domino la planificación de proyectos comerciales"
"Administración","trabajo en la optimización de procesos financieros"
"Administración","me gusta liderar equipos de trabajo multidisciplinarios"
"Administración","soy experto en el análisis de costos empresariales"
"Administración","disfruto gestionando el talento humano en las organizaciones"
"Administración","me gusta la administración estratégica"
"Administración","domino la dirección de proyectos comerciales"
"Administración","trabajo en la planificación financiera de empresas"
"Administración","me gusta analizar informes de gestión empresarial"
"Administración","soy bueno en la toma de decisiones financieras importantes"
"Administración","disfruto liderando equipos de trabajo en diferentes áreas"
"Administración","me gusta el análisis de riesgos en los negocios"
"Administración","domino la gestión de operaciones empresariales"
"Administración","trabajo en la creación de estrategias de marketing para empresas"
"Administración","me gusta optimizar los recursos financieros en las organizaciones"
"Administración","soy experto en el diseño de estructuras organizacionales eficientes"
"Administración","disfruto coordinando proyectos empresariales de distintos tamaños"
"Administración","me gusta el análisis de costos y beneficios"
"Administración","domino la gestión de la cadena de suministro en empresas"
"Administración","trabajo en la dirección y gestión de empresas"
"Negocios Internacionales","me gusta analizar el comercio internacional"
"Negocios Internacionales","soy bueno en la negociación de acuerdos comerciales"
"Negocios Internacionales","disfruto estudiando las tendencias globales de mercado"
"Negocios Internacionales","me gusta aprender sobre culturas empresariales diversas"
"Negocios Internacionales","me siento cómodo hablando varios idiomas en entornos empresariales"
"Negocios Internacionales","soy experto en el análisis de riesgos en transacciones internacionales"
"Negocios Internacionales","me gusta diseñar estrategias de expansión global"
"Negocios Internacionales","disfruto estudiando los mercados emergentes"
"Negocios Internacionales","me gusta el comercio electrónico a nivel internacional"
"Negocios Internacionales","soy bueno en el análisis de competidores globales"
"Negocios Internacionales","me gusta estudiar tratados internacionales de libre comercio"
"Negocios Internacionales","disfruto investigando las políticas arancelarias"
"Negocios Internacionales","tengo habilidades para gestionar operaciones aduaneras"
"Negocios Internacionales","me gusta el transporte y logística internacional"
"Negocios Internacionales","soy experto en la gestión de cadena de suministro global"
"Negocios Internacionales","me gusta analizar datos económicos a nivel mundial"
"Negocios Internacionales","disfruto diseñando estrategias de marketing internacional"
"Negocios Internacionales","me gusta la resolución de conflictos internacionales"
"Negocios Internacionales","soy bueno en la gestión de relaciones con clientes internacionales"
"Negocios Internacionales","me gusta estudiar la economía global"
"Negocios Internacionales","disfruto identificando oportunidades de inversión extranjera"
"Negocios Internacionales","tengo habilidades para liderar equipos multinacionales"
"Negocios Internacionales","me gusta la diversidad cultural en los negocios"
"Negocios Internacionales","me gusta estudiar casos de éxito en internacionalización de empresas"
"Negocios Internacionales","disfruto resolviendo problemas de importación y exportación"
"Negocios Internacionales","tengo habilidades para gestionar estrategias de precios internacionales"
"Negocios Internacionales","me gusta la apertura de nuevos mercados internacionales"
"Negocios Internacionales","soy bueno en el análisis de inversiones extranjeras directas"
"Negocios Internacionales","me gusta estudiar la geopolítica en el comercio global"
"Negocios Internacionales","disfruto negociando contratos internacionales"
"Negocios Internacionales","tengo habilidades para analizar el impacto de políticas comerciales"
"Negocios Internacionales","me gusta la gestión de riesgos cambiarios"
"Negocios Internacionales","soy experto en la selección de proveedores internacionales"
"Negocios Internacionales","me gusta estudiar los tratados de libre comercio"
"Negocios Internacionales","disfruto implementando estrategias de expansión internacional"
"Negocios Internacionales","tengo habilidades para liderar proyectos de internacionalización"
"Negocios Internacionales","me gusta el análisis de competitividad global"
"Negocios Internacionales","soy bueno en la gestión de riesgos financieros internacionales"
"Negocios Internacionales","me gusta estudiar la cultura de negocios en diferentes países"
"Negocios Internacionales","disfruto analizando indicadores económicos internacionales"
"Negocios Internacionales","tengo habilidades para diseñar estrategias de exportación"
"Negocios Internacionales","me gusta la gestión de alianzas estratégicas internacionales"
"Negocios Internacionales","soy experto en el análisis de tendencias de consumo global"
"Negocios Internacionales","me gusta estudiar la logística de transporte internacional"
"Negocios Internacionales","disfruto identificando oportunidades de negocio en mercados extranjeros"
"Negocios Internacionales","tengo habilidades para gestionar proyectos de cooperación internacional"
"Negocios Internacionales","me gusta el análisis de la competitividad internacional"
"Negocios Internacionales","soy bueno en la resolución de conflictos culturales en negocios"
"Negocios Internacionales","me gusta estudiar las políticas comerciales de diferentes países"
"Negocios Internacionales","disfruto evaluando estrategias de expansión global"
"Negocios Internacionales","me gusta la gestión de estrategias de mercado internacional"
"Negocios Internacionales","soy experto en la selección de modos de entrada a nuevos mercados"
"Negocios Internacionales","me gusta estudiar el impacto de eventos globales en los negocios"
"Negocios Internacionales","disfruto negociando acuerdos de cooperación internacional"
