"carrera","frase"
"Sin Area","No lo sé"
"Sin Area","No tengo idea"
"Sin Area","No estoy seguro"
"Sin Area","No podría decirte"
"Sin Area","No recuerdo eso"
"Sin Area","No me acuerdo"
"Sin Area","No tengo ni idea"
"Sin Area","No sabría decirte"
"Sin Area","No estoy convencido"
"Sin Area","No estoy seguro de eso"
"Sin Area","No tengo la menor idea"
"Sin Area","No me siento capacitado"
"Sin Area","No creo que pueda hacerlo"
"Sin Area","No tengo la experiencia necesaria"
"Sin Area","No cuento con las habilidades"
"Sin Area","No sé cómo responder"
"Sin Area","No puedo decidirme"
"Sin Area","No tengo conocimientos sobre eso"
"Sin Area","No me siento competente"
"Sin Area","No tengo la capacidad para eso"
"Sin Area","No tengo la información suficiente"
"Sin Area","No puedo determinar una respuesta"
"Sin Area","No me veo capaz de hacerlo"
"Sin Area","No tengo la formación necesaria"
"Sin Area","No estoy capacitado para responder"
"Sin Area","No creo tener la habilidad requerida"
"Sin Area","No tengo la certeza necesaria"
"Sin Area","No puedo hacerlo por el momento"
"Sin Area","No tengo los conocimientos necesarios"
"Sin Area","No siento que pueda hacerlo"
"Sin Area","No tengo la confianza suficiente"
"Sin Area","No puedo dar una respuesta clara"
"Sin Area","No tengo la habilidad para eso"
"Sin Area","No tengo una respuesta definitiva"
"Sin Area","No puedo responder adecuadamente"
"Sin Area","No tengo la competencia necesaria"
"Sin Area","No puedo llegar a una conclusión"
"Sin Area","No tengo suficiente información"
"Sin Area","No tengo la aptitud requerida"
"Sin Area","No puedo tomar una decisión ahora"
"Sin Area","No tengo los recursos necesarios"
"Sin Area","No me siento capaz de hacerlo"
"Sin Area","No tengo la experiencia suficiente"
"Sin Area","No puedo afirmar nada con certeza"
"Sin Area","No tengo la capacidad para responder"
"Sin Area","No sé si pueda hacerlo"
"Sin Area","No estoy seguro de mis habilidades"
"Sin Area","No tengo el conocimiento adecuado"
"Sin Area","No puedo decirte con exactitud"
"Sin Area","No tengo suficiente confianza"
"Sin Area","No puedo dar una respuesta precisa"
"Sin Area","No sé qué debería hacer"
"Sin Area","No tengo los medios para hacerlo"
"Sin Area","No tengo la experiencia requerida"
"Sin Area","No puedo tomar una decisión clara"
"Sin Area","No tengo las habilidades necesarias"
"Sin Area","No puedo recordar la información"
"Sin Area","No sé si soy capaz de hacerlo"
"Sin Area","No tengo la seguridad necesaria"
"Sin Area","No puedo determinar si es posible"
"Sin Area","No tengo la destreza requerida"
"Sin Area","No sé si puedo lograrlo"
"Sin Area","No tengo la respuesta correcta"
"Sin Area","No puedo responder de manera adecuada"
"Sin Area","No sé qué camino tomar"
"Sin Area","No tengo la competencia suficiente"
"Sin Area","No puedo afirmar nada al respecto"
"Sin Area","No sé si es posible hacerlo"
"Sin Area","No tengo la habilidad necesaria"
"Sin Area","No puedo dar una respuesta definitiva"
"Sin Area","No sé qué debería decir"
"Sin Area","No tengo la preparación necesaria"
"Sin Area","No puedo tomar una decisión ahora mismo"
"Sin Area","No tengo suficiente información para decidir"
"Sin Area","No sé si soy capaz de hacerlo bien"
"Sin Area","No tengo la certeza de mi respuesta"
"Sin Area","No puedo decirte con certeza absoluta"
"Sin Area","No sé si puedo hacerlo correctamente"
"Sin Area","No tengo la suficiente confianza en mi respuesta"
"Sin Area","No puedo recordar exactamente la información"
"Sin Area","No sé si tengo las habilidades requeridas"
"Sin Area","No tengo la experiencia o conocimientos necesarios"
"Sin Area","No puedo tomar una decisión con seguridad"
"Sin Area","No sé si es viable llevarlo a cabo"
"Sin Area","No tengo la capacidad para responder adecuadamente"
"Sin Area","No puedo dar una respuesta precisa en este momento"
"Sin Area","No sé qué camino seguir para resolverlo"
"Sin Area","No tengo la competencia o aptitud necesaria"
"Sin Area","No puedo afirmar con total seguridad"
"Sin Area","No sé si seré capaz de hacerlo correctamente"
"Sin Area","No tengo la seguridad de poder lograrlo"
"Sin Area","No puedo determinar si es la opción correcta"
"Sin Area","No sé si puedo lograrlo con éxito"
"Sin Area","No tengo la respuesta definitiva que buscas"
"Sin Area","No puedo responder de manera precisa"
"Sin Area","No sé qué decir en este caso"
"Sin Area","No tengo la preparación o experiencia necesaria"
"Sin Area","No puedo tomar una decisión en este momento"
"Sin Area","No tengo suficiente información para dar una respuesta"
"Sin Area","No sé si seré capaz de hacerlo bien"
"Sin Area","No tengo la certeza absoluta de mi respuesta"
"Sin Area","No puedo decirte con total certeza"
"Sin Area","No sé si puedo hacerlo de manera correcta"
"Sin Area","No tengo la confianza suficiente en mi respuesta"
"Sin Area","No puedo recordar toda la información necesaria"
"Sin Area","No sé si tengo las habilidades suficientes"
"Sin Area","No tengo la experiencia o conocimientos suficientes"
"Sin Area","No puedo tomar una decisión con total seguridad"
"Sin Area","No sé si es posible realizarlo"
"Sin Area","No tengo la capacidad para responder en este momento"
"Sin Area","No puedo dar una respuesta precisa ahora"
"Sin Area","No sé qué camino tomar para solucionarlo"
"Sin Area","No tengo la competencia o aptitud requerida"
"Sin Area","No puedo afirmar con total certeza"
"Sin Area","No sé si podré hacerlo correctamente"
"Sin Area","No tengo la seguridad de poder lograrlo con éxito"
"Sin Area","No puedo determinar si es la mejor opción"
"Sin Area","No sé si puedo lograrlo de manera exitosa"
"Sin Area","No tengo la respuesta definitiva que estás buscando"
"Sin Area","No puedo responder de manera exacta"
"Sin Area","No sé qué decir en esta situación"
"Sin Area","No tengo la preparación o experiencia suficiente"
"Sin Area","No puedo tomar una decisión definitiva en este momento"
"Sin Area","No tengo suficiente información para responder con certeza"
"Sin Area","No sé si seré capaz de hacerlo correctamente"
"Sin Area","No tengo la certeza absoluta de mi respuesta en este caso"
"Sin Area","No puedo decirte con total certeza absoluta"
"Sin Area","No sé si puedo hacerlo de manera adecuada"
"Sin Area","No tengo la confianza suficiente en mi respuesta actual"
"Sin Area","No puedo recordar todos los detalles necesarios"
"Sin Area","No sé si tengo las habilidades requeridas para hacerlo"
"Sin Area","No tengo la experiencia o conocimientos suficientes para resolverlo"
"Sin Area","No puedo tomar una decisión con total seguridad en este momento"
"Sin Area","No sé si es posible llevar a cabo esta acción"
"Sin Area","No tengo la capacidad para responder adecuadamente en este instante"
"Sin Area","No puedo dar una respuesta precisa en este momento"
"Sin Area","No sé qué camino seguir para solucionar esta cuestión"
"Sin Area","No tengo la competencia o aptitud requerida para responder"
"Sin Area","No puedo afirmar con total certeza en este momento"
"Sin Area","No sé si podré hacerlo de manera correcta"
"Sin Area","No tengo la seguridad de poder lograrlo con éxito en esta situación"
"Sin Area","No puedo determinar si es la opción más acertada"
"Sin Area","No sé si puedo lograrlo de manera exitosa en este caso"
"Sin Area","No tengo la respuesta definitiva que buscas en este momento"
"Sin Area","No puedo responder de manera exacta ahora mismo"
"Sin Area","No sé qué decir en esta ocasión"
"Sin Area","No tengo la preparación o experiencia necesaria para esto"
"Sin Area","No puedo tomar una decisión definitiva ahora mismo"
"Sin Area","No tengo suficiente información para responder con certeza absoluta"
"Sin Area","No sé si seré capaz de hacerlo correctamente en esta circunstancia"
"Sin Area","No tengo la certeza absoluta de mi respuesta en esta situación"
"Sin Area","No puedo decirte con total certeza absoluta en este caso"
"Sin Area","No sé si puedo hacerlo de manera adecuada en este contexto"
"Sin Area","No tengo la confianza suficiente en mi respuesta actualmente"
"Sin Area","No puedo recordar todos los detalles necesarios en este momento"
"Sin Area","No sé si tengo las habilidades requeridas para hacerlo bien"
"Sin Area","No puedo tomar una decisión con total seguridad en este instante"
"Sin Area","No sé si es posible llevar a cabo esta acción de manera efectiva"
"Sin Area","No tengo la capacidad para responder adecuadamente en este instante"
"Sin Area","No puedo dar una respuesta precisa ahora mismo"
"Sin Area","No puedo afirmar con total certeza en este momento"
"Sin Area","No sé si podré hacerlo de manera correcta en este caso"
"Sin Area","No puedo determinar si es la opción más acertada en este momento"
"Sin Area","No sé si puedo lograrlo de manera exitosa en esta ocasión"
"Sin Area","No tengo la respuesta definitiva que buscas en este instante"
"Sin Area","No puedo responder de manera exacta en este momento"
"Sin Area","No sé qué decir en esta situación particular"
"Sin Area","No tengo la preparación o experiencia necesaria para esto ahora"
"Sin Area","No puedo tomar una decisión definitiva en este momento preciso"
"Sin Area","No puedo dar una respuesta precisa ahora mismo en este caso"
"Sin Area","No puedo afirmar con total certeza en este momento específico"
"Sin Area","No puedo responder de manera exacta en este momento específico"
"Sin Area","No sé qué decir en esta situación particular actual"
"Comunicación Pública","me encanta expresar ideas creativas"
"Comunicación Pública","disfruto escribiendo artículos interesantes"
"Comunicación Pública","soy hábil comunicando con audiencias diversas"
"Comunicación Pública","me gusta investigar temas de actualidad"
"Comunicación Pública","comunico de forma efectiva en público"
"Comunicación Pública","me gusta diseñar campañas de comunicación"
"Comunicación Pública","soy bueno organizando eventos y conferencias"
"Comunicación Pública","disfruto trabajando en equipo en proyectos comunicativos"
"Comunicación Pública","analizo mensajes mediáticos de manera crítica"
"Comunicación Pública","me siento cómodo dando discursos persuasivos"
"Comunicación Pública","me interesan las redes sociales como herramienta comunicativa"
"Comunicación Pública","soy creativo generando contenido audiovisual"
"Comunicación Pública","me gusta mantenerme informado sobre noticias globales"
"Comunicación Pública","disfruto produciendo programas de radio"
"Comunicación Pública","me gusta el periodismo de investigación"
"Comunicación Pública","soy bueno resolviendo conflictos comunicativos"
"Comunicación Pública","me interesa la publicidad y el marketing"
"Comunicación Pública","disfruto analizando audiencias y su comportamiento"
"Comunicación Pública","soy hábil redactando comunicados de prensa"
"Comunicación Pública","me gusta la fotografía como medio de expresión"
"Comunicación Pública","soy bueno creando estrategias de comunicación interna"
"Comunicación Pública","me gusta la cultura y su difusión"
"Comunicación Pública","disfruto participando en debates y mesas redondas"
"Comunicación Pública","me gusta trabajar en proyectos de responsabilidad social"
"Comunicación Pública","soy hábil en relaciones públicas y networking"
"Comunicación Pública","me interesa la ética en la comunicación"
"Comunicación Pública","disfruto generando contenido para blogs y sitios web"
"Comunicación Pública","me siento cómodo en el ámbito político y gubernamental"
"Comunicación Pública","soy bueno en la producción de videos educativos"
"Comunicación Pública","me gusta la comunicación intercultural"
"Comunicación Pública","disfruto trabajando en proyectos de relaciones internacionales"
"Comunicación Pública","me gusta la oratoria y el debate público"
"Comunicación Pública","soy hábil en la gestión de crisis de comunicación"
"Comunicación Pública","me interesa el periodismo de moda y entretenimiento"
"Comunicación Pública","disfruto creando contenido para redes sociales"
"Comunicación Pública","soy bueno en la investigación de opinión pública"
"Comunicación Pública","me gusta la comunicación política"
"Comunicación Pública","me gusta trabajar en proyectos de promoción cultural"
"Comunicación Pública","soy hábil en el manejo de crisis de reputación"
"Comunicación Pública","disfruto trabajando en medios de comunicación"
"Comunicación Pública","me interesa el periodismo de investigación"
"Comunicación Pública","soy bueno generando contenido multimedia"
"Comunicación Pública","me gusta diseñar estrategias de comunicación política"
"Comunicación Pública","soy hábil en el manejo de herramientas de edición de video"
"Comunicación Pública","disfruto participando en proyectos de comunicación comunitaria"
"Comunicación Pública","me gusta la comunicación empresarial"
"Comunicación Pública","me gusta analizar tendencias de comunicación digital"
"Comunicación Pública","soy bueno en la creación de contenidos visuales"
"Comunicación Pública","me interesa la fotografía periodística"
"Comunicación Pública","disfruto trabajando en campañas de concientización"
"Comunicación Pública","soy hábil en la gestión de redes sociales"
"Comunicación Pública","me gusta el storytelling y la narrativa"
"Comunicación Pública","me gusta trabajar en proyectos de comunicación educativa"
"Comunicación Pública","soy bueno en la producción de contenidos para televisión"
"Comunicación Pública","me interesa el periodismo de investigación social"
"Comunicación Pública","disfruto diseñando campañas de marketing digital"
"Comunicación Pública","soy hábil en la gestión de medios y relaciones con periodistas"
"Comunicación Pública","me gusta el análisis de contenido mediático"
"Comunicación Pública","me gusta trabajar en proyectos de comunicación política y electoral"
"Comunicación Pública","soy bueno en la redacción creativa"
"Comunicación Pública","me interesa la comunicación audiovisual"
"Comunicación Pública","disfruto analizando estrategias de branding"
"Comunicación Pública","soy hábil en la creación de campañas publicitarias"
"Comunicación Pública","me gusta el periodismo deportivo"
"Comunicación Pública","me gusta trabajar en proyectos de comunicación ambiental"
"Comunicación Pública","soy bueno en la producción de podcasts"
"Comunicación Pública","me interesa la comunicación en crisis"
"Comunicación Pública","disfruto trabajando en proyectos de comunicación internacional"
"Comunicación Pública","soy hábil en la edición de fotografías"
"Comunicación Pública","me gusta el periodismo científico"
"Comunicación Pública","me gusta la comunicación en el ámbito educativo"
"Comunicación Pública","soy bueno en la planificación de eventos culturales"
"Comunicación Pública","disfruto diseñando estrategias de relaciones públicas"
"Comunicación Pública","soy hábil en el análisis de discurso político"
"Comunicación Pública","me interesa la comunicación organizacional"
"Comunicación Pública","me gusta trabajar en proyectos de comunicación para el desarrollo"
"Comunicación Pública","soy bueno en la producción de documentales"
"Comunicación Pública","me gusta la comunicación interpersonal"
"Comunicación Pública","disfruto analizando el impacto de los medios en la sociedad"
"Comunicación Pública","soy hábil en la creación de estrategias de contenido"
"Comunicación Pública","me gusta la comunicación política internacional"
"Comunicación Pública","me interesa el periodismo de guerra y conflictos"
"Comunicación Pública","disfruto trabajando en proyectos de responsabilidad social empresarial"
"Comunicación Pública","soy bueno en la creación de contenidos para medios impresos"
"Comunicación Pública","me gusta el análisis de medios y opinión pública"
"Comunicación Pública","me gusta trabajar en proyectos de comunicación para la igualdad de género"
"Comunicación Pública","soy hábil en la producción de cortometrajes"
"Comunicación Pública","disfruto diseñando estrategias de comunicación interna"
"Comunicación Pública","soy bueno en la investigación de medios de comunicación"
"Comunicación Pública","me interesa la comunicación política y gubernamental"
"Comunicación Pública","me gusta trabajar en proyectos de comunicación intercultural"
"Comunicación Pública","soy hábil en la creación de campañas de concientización"
"Comunicación Pública","me gusta la comunicación en el ámbito educativo"
"Comunicación Pública","disfruto analizando el discurso mediático"
"Comunicación Pública","soy bueno en la producción de videos promocionales"
"Comunicación Pública","me gusta la comunicación en el ámbito empresarial"
"Comunicación Pública","me interesa el periodismo de investigación política"
"Comunicación Pública","disfruto trabajando en proyectos de comunicación comunitaria"
"Comunicación Pública","soy hábil en la creación de estrategias de relaciones internacionales"
"Comunicación Pública","me gusta el análisis de contenido en redes sociales"
"Comunicación Pública","me gusta trabajar en proyectos de comunicación ambiental"
"Comunicación Pública","soy bueno en la producción de podcasts educativos"
"Comunicación Pública","me interesa la comunicación en situaciones de crisis"
"Comunicación Pública","disfruto analizando el impacto de los medios en la cultura"
"Comunicación Pública","soy hábil en la creación de estrategias de comunicación política"
"Comunicación Pública","me gusta la comunicación en el ámbito organizacional"
"Comunicación Pública","me gusta trabajar en proyectos de comunicación para el desarrollo"
"Periodismo","me gusta investigar para contar historias veraces"
"Periodismo","disfruto escribiendo artículos de actualidad"
"Periodismo","soy bueno entrevistando a personas interesantes"
"Periodismo","me gusta investigar casos de corrupción"
"Periodismo","disfruto narrando acontecimientos importantes"
"Periodismo","me gusta el periodismo de investigación"
"Periodismo","soy hábil en redacción y edición de noticias"
"Periodismo","me gusta trabajar en proyectos multimedia"
"Periodismo","disfruto reportando desde el lugar de los hechos"
"Periodismo","me gusta el periodismo de datos"
"Periodismo","soy bueno en el análisis de información"
"Periodismo","me gusta entrevistar a personalidades del entretenimiento"
"Periodismo","disfruto cubriendo eventos culturales"
"Periodismo","me gusta el periodismo deportivo"
"Periodismo","soy hábil en la creación de crónicas periodísticas"
"Periodismo","me gusta investigar temas políticos"
"Periodismo","disfruto reportando desde zonas conflictivas"
"Periodismo","me gusta el periodismo científico"
"Periodismo","soy bueno en la cobertura de noticias internacionales"
"Periodismo","me gusta analizar medios de comunicación"
"Periodismo","disfruto escribiendo reportajes de interés humano"
"Periodismo","me gusta el periodismo de opinión"
"Periodismo","soy hábil en el manejo de redes sociales para informar"
"Periodismo","me gusta investigar temas de justicia social"
"Periodismo","disfruto produciendo contenido audiovisual informativo"
"Periodismo","me gusta la fotografía periodística"
"Periodismo","soy bueno en la redacción de críticas culturales"
"Periodismo","me gusta trabajar en proyectos de periodismo comunitario"
"Periodismo","disfruto escribiendo crónicas deportivas"
"Periodismo","me gusta el periodismo económico y de negocios"
"Periodismo","soy hábil en la creación de reportajes gráficos"
"Periodismo","me gusta investigar temas de medio ambiente"
"Periodismo","disfruto entrevistando a líderes políticos"
"Periodismo","me gusta el periodismo de guerra y conflictos"
"Periodismo","soy bueno en el análisis de discursos políticos"
"Periodismo","me gusta reportar sobre avances científicos"
"Periodismo","disfruto narrando experiencias culturales"
"Periodismo","me gusta el periodismo digital"
"Periodismo","soy hábil en la producción de documentales informativos"
"Periodismo","me gusta investigar temas de educación"
"Periodismo","disfruto reportando sobre temas de salud"
"Periodismo","me gusta el periodismo tecnológico"
"Periodismo","soy bueno en la creación de noticias visuales"
"Periodismo","me gusta entrevistar a expertos en ciencia"
"Periodismo","disfruto escribiendo crónicas sociales"
"Periodismo","me gusta el periodismo político"
"Periodismo","soy hábil en el análisis de tendencias sociales"
"Periodismo","me gusta investigar temas de derechos humanos"
"Periodismo","disfruto reportando sobre temas educativos"
"Periodismo","me gusta el periodismo de espectáculos"
"Periodismo","soy bueno en la redacción de reportajes deportivos"
"Periodismo","me gusta cubrir eventos deportivos en vivo"
"Periodismo","disfruto escribiendo sobre ciencia y tecnología"
"Periodismo","me gusta el periodismo ambiental"
"Periodismo","soy hábil en el análisis de la política internacional"
"Periodismo","me gusta investigar temas de cultura popular"
"Periodismo","disfruto reportando sobre avances médicos"
"Periodismo","me gusta el periodismo de moda y belleza"
"Periodismo","soy bueno en la redacción de reportajes culturales"
"Periodismo","me gusta entrevistar a artistas y músicos"
"Periodismo","disfruto escribiendo sobre temas gastronómicos"
"Periodismo","me gusta el periodismo de viajes"
"Periodismo","soy hábil en la cobertura de eventos culturales"
"Periodismo","me gusta investigar temas históricos"
"Periodismo","disfruto reportando sobre temas de justicia"
"Periodismo","me gusta el periodismo social y de género"
"Periodismo","soy bueno en el análisis de noticias internacionales"
"Periodismo","me gusta reportar sobre avances tecnológicos"
"Periodismo","disfruto escribiendo sobre temas educativos"
"Periodismo","me gusta el periodismo científico y de salud"
"Periodismo","soy hábil en la redacción de reportajes políticos"
"Periodismo","me gusta investigar temas de arte y cultura"
"Periodismo","disfruto reportando sobre temas ambientales"
"Periodismo","me gusta el periodismo de investigación criminal"
"Periodismo","soy bueno en el análisis de medios de comunicación"
"Periodismo","me gusta entrevistar a líderes empresariales"
"Periodismo","disfruto escribiendo sobre temas tecnológicos"
"Periodismo","me gusta el periodismo deportivo y de aventura"
"Periodismo","soy hábil en la producción de noticias en video"
"Periodismo","me gusta investigar temas políticos y sociales"
"Periodismo","disfruto reportando sobre temas de salud y bienestar"
"Periodismo","me gusta el periodismo de negocios y finanzas"
"Periodismo","soy bueno en el análisis de discursos políticos"
"Periodismo","me gusta entrevistar a expertos en ciencia y tecnología"
"Periodismo","disfruto escribiendo crónicas culturales"
"Periodismo","me gusta el periodismo internacional"
"Periodismo","soy hábil en la cobertura de eventos políticos"
"Periodismo","me gusta investigar temas de cultura y sociedad"
"Periodismo","disfruto reportando sobre temas de medio ambiente"
"Periodismo","me gusta el periodismo de investigación político"
"Periodismo","soy bueno en la redacción de crónicas deportivas"
"Periodismo","me gusta entrevistar a personalidades del entretenimiento"
"Periodismo","disfruto cubriendo eventos culturales en vivo"
"Periodismo","me gusta el periodismo científico y tecnológico"
"Periodismo","soy hábil en la creación de noticias multimedia"
"Periodismo","me gusta investigar temas de política internacional"
"Periodismo","disfruto reportando desde lugares históricos"
"Periodismo","me gusta el periodismo deportivo y de salud"
"Periodismo","soy bueno en el análisis de tendencias de moda"
"Periodismo","me gusta escribir sobre temas de cultura urbana"
"Periodismo","disfruto narrando experiencias de viaje"
"Periodismo","me gusta el periodismo de investigación social"
"Periodismo","soy hábil en la producción de documentales políticos"
"Periodismo","me gusta investigar temas de derechos humanos y justicia"
"Periodismo","disfruto reportando sobre temas de educación y ciencia"
"Periodismo","me gusta el periodismo de entretenimiento y espectáculos"
"Periodismo","soy bueno en la redacción de reportajes políticos y sociales"
"Periodismo","me gusta entrevistar a líderes políticos y sociales"
"Periodismo","disfruto escribiendo sobre temas culturales y artísticos"
"Periodismo","me gusta el periodismo de investigación económico"
"Periodismo","soy hábil en el análisis de discursos políticos y económicos"
"Periodismo","me gusta investigar temas de medio ambiente y sostenibilidad"
"Periodismo","disfruto reportando sobre temas de salud y bienestar"
"Periodismo","me gusta el periodismo de negocios y finanzas internacionales"
"Periodismo","soy bueno en el análisis de tendencias económicas y sociales"
"Periodismo","me gusta entrevistar a expertos en política y economía"
"Periodismo","disfruto escribiendo crónicas culturales y gastronómicas"
"Periodismo","me gusta el periodismo internacional y geopolítico"
"Periodismo","soy hábil en la producción de noticias multimedia en video"
"Periodismo","me gusta investigar temas de cultura y sociedad a nivel global"
"Periodismo","disfruto reportando desde lugares históricos y arqueológicos"
"Periodismo","me gusta el periodismo deportivo y de salud a nivel internacional"
"Periodismo","soy bueno en el análisis de tendencias de moda y belleza"
"Periodismo","me gusta escribir sobre temas de cultura urbana y tendencias juveniles"
"Periodismo","disfruto narrando experiencias de viaje y exploración cultural"
"Periodismo","me gusta el periodismo de investigación social y antropológico"
"Periodismo","soy hábil en la producción de documentales políticos y sociales"
"Periodismo","me gusta investigar temas de derechos humanos y justicia a nivel global"

