"carrera","frase"
"Sin Area","No lo sé"
"Sin Area","No tengo idea"
"Sin Area","No estoy seguro"
"Sin Area","No podría decirte"
"Sin Area","No recuerdo eso"
"Sin Area","No me acuerdo"
"Sin Area","No tengo ni idea"
"Sin Area","No sabría decirte"
"Sin Area","No estoy convencido"
"Sin Area","No estoy seguro de eso"
"Sin Area","No tengo la menor idea"
"Sin Area","No me siento capacitado"
"Sin Area","No creo que pueda hacerlo"
"Sin Area","No tengo la experiencia necesaria"
"Sin Area","No cuento con las habilidades"
"Sin Area","No sé cómo responder"
"Sin Area","No puedo decidirme"
"Sin Area","No tengo conocimientos sobre eso"
"Sin Area","No me siento competente"
"Sin Area","No tengo la capacidad para eso"
"Sin Area","No tengo la información suficiente"
"Sin Area","No puedo determinar una respuesta"
"Sin Area","No me veo capaz de hacerlo"
"Sin Area","No tengo la formación necesaria"
"Sin Area","No estoy capacitado para responder"
"Sin Area","No creo tener la habilidad requerida"
"Sin Area","No tengo la certeza necesaria"
"Sin Area","No puedo hacerlo por el momento"
"Sin Area","No tengo los conocimientos necesarios"
"Sin Area","No siento que pueda hacerlo"
"Sin Area","No tengo la confianza suficiente"
"Sin Area","No puedo dar una respuesta clara"
"Sin Area","No tengo la habilidad para eso"
"Sin Area","No tengo una respuesta definitiva"
"Sin Area","No puedo responder adecuadamente"
"Sin Area","No tengo la competencia necesaria"
"Sin Area","No puedo llegar a una conclusión"
"Sin Area","No tengo suficiente información"
"Sin Area","No tengo la aptitud requerida"
"Sin Area","No puedo tomar una decisión ahora"
"Sin Area","No tengo los recursos necesarios"
"Sin Area","No me siento capaz de hacerlo"
"Sin Area","No tengo la experiencia suficiente"
"Sin Area","No puedo afirmar nada con certeza"
"Sin Area","No tengo la capacidad para responder"
"Sin Area","No sé si pueda hacerlo"
"Sin Area","No estoy seguro de mis habilidades"
"Sin Area","No tengo el conocimiento adecuado"
"Sin Area","No puedo decirte con exactitud"
"Sin Area","No tengo suficiente confianza"
"Sin Area","No puedo dar una respuesta precisa"
"Sin Area","No sé qué debería hacer"
"Sin Area","No tengo los medios para hacerlo"
"Sin Area","No tengo la experiencia requerida"
"Sin Area","No puedo tomar una decisión clara"
"Sin Area","No tengo las habilidades necesarias"
"Sin Area","No puedo recordar la información"
"Sin Area","No sé si soy capaz de hacerlo"
"Sin Area","No tengo la seguridad necesaria"
"Sin Area","No puedo determinar si es posible"
"Sin Area","No tengo la destreza requerida"
"Sin Area","No sé si puedo lograrlo"
"Sin Area","No tengo la respuesta correcta"
"Sin Area","No puedo responder de manera adecuada"
"Sin Area","No sé qué camino tomar"
"Sin Area","No tengo la competencia suficiente"
"Sin Area","No puedo afirmar nada al respecto"
"Sin Area","No sé si es posible hacerlo"
"Sin Area","No tengo la habilidad necesaria"
"Sin Area","No puedo dar una respuesta definitiva"
"Sin Area","No sé qué debería decir"
"Sin Area","No tengo la preparación necesaria"
"Sin Area","No puedo tomar una decisión ahora mismo"
"Sin Area","No tengo suficiente información para decidir"
"Sin Area","No sé si soy capaz de hacerlo bien"
"Sin Area","No tengo la certeza de mi respuesta"
"Sin Area","No puedo decirte con certeza absoluta"
"Sin Area","No sé si puedo hacerlo correctamente"
"Sin Area","No tengo la suficiente confianza en mi respuesta"
"Sin Area","No puedo recordar exactamente la información"
"Sin Area","No sé si tengo las habilidades requeridas"
"Sin Area","No tengo la experiencia o conocimientos necesarios"
"Sin Area","No puedo tomar una decisión con seguridad"
"Sin Area","No sé si es viable llevarlo a cabo"
"Sin Area","No tengo la capacidad para responder adecuadamente"
"Sin Area","No puedo dar una respuesta precisa en este momento"
"Sin Area","No sé qué camino seguir para resolverlo"
"Sin Area","No tengo la competencia o aptitud necesaria"
"Sin Area","No puedo afirmar con total seguridad"
"Sin Area","No sé si seré capaz de hacerlo correctamente"
"Sin Area","No tengo la seguridad de poder lograrlo"
"Sin Area","No puedo determinar si es la opción correcta"
"Sin Area","No sé si puedo lograrlo con éxito"
"Sin Area","No tengo la respuesta definitiva que buscas"
"Sin Area","No puedo responder de manera precisa"
"Sin Area","No sé qué decir en este caso"
"Sin Area","No tengo la preparación o experiencia necesaria"
"Sin Area","No puedo tomar una decisión en este momento"
"Sin Area","No tengo suficiente información para dar una respuesta"
"Sin Area","No sé si seré capaz de hacerlo bien"
"Sin Area","No tengo la certeza absoluta de mi respuesta"
"Sin Area","No puedo decirte con total certeza"
"Sin Area","No sé si puedo hacerlo de manera correcta"
"Sin Area","No tengo la confianza suficiente en mi respuesta"
"Sin Area","No puedo recordar toda la información necesaria"
"Sin Area","No sé si tengo las habilidades suficientes"
"Sin Area","No tengo la experiencia o conocimientos suficientes"
"Sin Area","No puedo tomar una decisión con total seguridad"
"Sin Area","No sé si es posible realizarlo"
"Sin Area","No tengo la capacidad para responder en este momento"
"Sin Area","No puedo dar una respuesta precisa ahora"
"Sin Area","No sé qué camino tomar para solucionarlo"
"Sin Area","No tengo la competencia o aptitud requerida"
"Sin Area","No puedo afirmar con total certeza"
"Sin Area","No sé si podré hacerlo correctamente"
"Sin Area","No tengo la seguridad de poder lograrlo con éxito"
"Sin Area","No puedo determinar si es la mejor opción"
"Sin Area","No sé si puedo lograrlo de manera exitosa"
"Sin Area","No tengo la respuesta definitiva que estás buscando"
"Sin Area","No puedo responder de manera exacta"
"Sin Area","No sé qué decir en esta situación"
"Sin Area","No tengo la preparación o experiencia suficiente"
"Sin Area","No puedo tomar una decisión definitiva en este momento"
"Sin Area","No tengo suficiente información para responder con certeza"
"Sin Area","No sé si seré capaz de hacerlo correctamente"
"Sin Area","No tengo la certeza absoluta de mi respuesta en este caso"
"Sin Area","No puedo decirte con total certeza absoluta"
"Sin Area","No sé si puedo hacerlo de manera adecuada"
"Sin Area","No tengo la confianza suficiente en mi respuesta actual"
"Sin Area","No puedo recordar todos los detalles necesarios"
"Sin Area","No sé si tengo las habilidades requeridas para hacerlo"
"Sin Area","No tengo la experiencia o conocimientos suficientes para resolverlo"
"Sin Area","No puedo tomar una decisión con total seguridad en este momento"
"Sin Area","No sé si es posible llevar a cabo esta acción"
"Sin Area","No tengo la capacidad para responder adecuadamente en este instante"
"Sin Area","No puedo dar una respuesta precisa en este momento"
"Sin Area","No sé qué camino seguir para solucionar esta cuestión"
"Sin Area","No tengo la competencia o aptitud requerida para responder"
"Sin Area","No puedo afirmar con total certeza en este momento"
"Sin Area","No sé si podré hacerlo de manera correcta"
"Sin Area","No tengo la seguridad de poder lograrlo con éxito en esta situación"
"Sin Area","No puedo determinar si es la opción más acertada"
"Sin Area","No sé si puedo lograrlo de manera exitosa en este caso"
"Sin Area","No tengo la respuesta definitiva que buscas en este momento"
"Sin Area","No puedo responder de manera exacta ahora mismo"
"Sin Area","No sé qué decir en esta ocasión"
"Sin Area","No tengo la preparación o experiencia necesaria para esto"
"Sin Area","No puedo tomar una decisión definitiva ahora mismo"
"Sin Area","No tengo suficiente información para responder con certeza absoluta"
"Sin Area","No sé si seré capaz de hacerlo correctamente en esta circunstancia"
"Sin Area","No tengo la certeza absoluta de mi respuesta en esta situación"
"Sin Area","No puedo decirte con total certeza absoluta en este caso"
"Sin Area","No sé si puedo hacerlo de manera adecuada en este contexto"
"Sin Area","No tengo la confianza suficiente en mi respuesta actualmente"
"Sin Area","No puedo recordar todos los detalles necesarios en este momento"
"Sin Area","No sé si tengo las habilidades requeridas para hacerlo bien"
"Sin Area","No puedo tomar una decisión con total seguridad en este instante"
"Sin Area","No sé si es posible llevar a cabo esta acción de manera efectiva"
"Sin Area","No tengo la capacidad para responder adecuadamente en este instante"
"Sin Area","No puedo dar una respuesta precisa ahora mismo"
"Sin Area","No puedo afirmar con total certeza en este momento"
"Sin Area","No sé si podré hacerlo de manera correcta en este caso"
"Sin Area","No puedo determinar si es la opción más acertada en este momento"
"Sin Area","No sé si puedo lograrlo de manera exitosa en esta ocasión"
"Sin Area","No tengo la respuesta definitiva que buscas en este instante"
"Sin Area","No puedo responder de manera exacta en este momento"
"Sin Area","No sé qué decir en esta situación particular"
"Sin Area","No tengo la preparación o experiencia necesaria para esto ahora"
"Sin Area","No puedo tomar una decisión definitiva en este momento preciso"
"Sin Area","No puedo dar una respuesta precisa ahora mismo en este caso"
"Sin Area","No puedo afirmar con total certeza en este momento específico"
"Sin Area","No puedo responder de manera exacta en este momento específico"
"Sin Area","No sé qué decir en esta situación particular actual"
"Biología","Disfruto explorando ecosistemas naturales"
"Biología","Investigo el comportamiento animal en laboratorios"
"Biología","Analizo muestras microscópicas con precisión"
"Biología","Me gusta estudiar la biodiversidad marina"
"Biología","Identifico especies de plantas y animales"
"Biología","Participo en investigaciones sobre genética"
"Biología","Realizo análisis estadísticos de datos biológicos"
"Biología","Me siento fascinado por la evolución de las especies"
"Biología","Contribuyo a la conservación del medio ambiente"
"Biología","Tomando muestras de suelos para análisis"
"Biología","Comprendo los procesos de reproducción celular"
"Biología","Investigo sobre enfermedades y su prevención"
"Biología","Participo en expediciones para la investigación de fauna"
"Biología","Analizo datos para comprender patrones ecológicos"
"Biología","Estudio la anatomía de organismos vivos"
"Biología","Investigo sobre la interacción entre especies"
"Biología","Contribuyo a la restauración de ecosistemas dañados"
"Biología","Exploro la microbiología y sus aplicaciones"
"Biología","Realizo experimentos para entender procesos biológicos"
"Biología","Me intereso por la conservación de especies en peligro"
"Biología","Participo en estudios de ecología urbana"
"Biología","Analizo muestras de sangre para detectar enfermedades"
"Biología","Me gusta investigar sobre la anatomía humana"
"Biología","Estudio la fisiología de organismos vivos"
"Biología","Exploro la diversidad de hongos en el ecosistema"
"Biología","Participo en programas de reforestación"
"Biología","Analizo datos moleculares para entender la evolución"
"Biología","Estudio la migración de aves y su impacto en el ecosistema"
"Biología","Contribuyo a la conservación de especies en peligro"
"Biología","Participo en investigaciones sobre enfermedades tropicales"
"Biología","Exploro la interacción entre la fauna y la flora"
"Biología","Realizo estudios sobre la dinámica poblacional de animales"
"Biología","Me gusta estudiar la ecología marina"
"Biología","Contribuyo a la investigación de terapias génicas"
"Biología","Investigo sobre el efecto del cambio climático en la biodiversidad"
"Biología","Estudio la anatomía comparada de diferentes especies"
"Biología","Exploro la biología molecular y sus aplicaciones"
"Biología","Realizo estudios sobre la biología de la conservación"
"Biología","Me interesan los avances en biotecnología"
"Biología","Contribuyo a la comprensión de la ecología acuática"
"Biología","Participo en proyectos de restauración de humedales"
"Biología","Analizo datos para entender la evolución de enfermedades"
"Biología","Investigo sobre la biodiversidad en ecosistemas terrestres"
"Biología","Estudio la genética de poblaciones animales"
"Biología","Exploro la biología del desarrollo y la diferenciación celular"
"Biología","Realizo investigaciones sobre comportamiento animal"
"Biología","Me gusta estudiar la adaptación de los seres vivos al medio ambiente"
"Biología","Contribuyo a la conservación de especies marinas"
"Biología","Participo en proyectos de rescate de animales en peligro"
"Biología","Analizo muestras ambientales para detectar contaminantes"
"Biología","Estudio la ecología de comunidades vegetales"
"Biología","Investigo sobre la biología de las enfermedades infecciosas"
"Biología","Exploro la taxonomía y la clasificación de organismos"
"Biología","Realizo estudios sobre la fisiología de organismos acuáticos"
"Biología","Me gusta investigar sobre la evolución humana"
"Biología","Contribuyo a la conservación de hábitats naturales"
"Biología","Participo en proyectos de rescate de especies en extinción"
"Biología","Analizo datos genéticos para entender la evolución"
"Biología","Investigo sobre la ecología de sistemas acuáticos"
"Biología","Estudio la fisiología de organismos marinos"
"Biología","Exploro la biología estructural y funcional de proteínas"
"Biología","Realizo investigaciones sobre la dinámica de poblaciones"
"Biología","Me gusta estudiar la biología de organismos invertebrados"
"Biología","Contribuyo a la conservación de especies endémicas"
"Biología","Participo en programas de monitoreo de fauna"
"Biología","Analizo muestras de suelo para estudios de edafología"
"Biología","Estudio la ecología de sistemas forestales"
"Biología","Investigo sobre la biología molecular de microorganismos"
"Biología","Exploro la genómica y sus aplicaciones en la biología"
"Biología","Realizo estudios sobre la biología de poblaciones humanas"
"Biología","Me gusta investigar sobre la ecología de ecosistemas acuáticos"
"Biología","Contribuyo a la conservación de especies en vías de extinción"
"Biología","Participo en investigaciones sobre bioprospección"
"Biología","Analizo datos para entender la evolución de comportamientos"
"Biología","Investigo sobre la ecología de sistemas terrestres"
"Biología","Estudio la biología del desarrollo embrionario"
"Biología","Exploro la ingeniería genética y sus aplicaciones"
"Biología","Realizo investigaciones sobre la conservación de bosques"
"Biología","Me gusta estudiar la biología de organismos vertebrados"
"Biología","Contribuyo a la conservación de especies migratorias"
"Biología","Participo en programas de rescate de animales marinos"
"Biología","Analizo datos genómicos para entender la diversidad"
"Biología","Investigo sobre la ecología de sistemas urbanos"
"Biología","Estudio la biología del comportamiento animal"
"Biología","Exploro la biotecnología vegetal y sus aplicaciones"
"Biología","Realizo estudios sobre la biología de poblaciones animales"
"Biología","Me gusta investigar sobre la ecología de ecosistemas terrestres"
"Biología","Contribuyo a la conservación de especies en peligro de extinción"
"Biología","Participo en investigaciones sobre biología molecular"
"Biología","Analizo datos para entender la evolución de patrones de coloración"
"Biología","Investigo sobre la ecología de sistemas costeros"
"Biología","Estudio la biología de la reproducción en animales"
"Biología","Exploro la biotecnología marina y sus aplicaciones"
"Biología","Realizo investigaciones sobre la conservación de ecosistemas"
"Biología","Me gusta estudiar la biología de organismos acuáticos"
"Biología","Contribuyo a la conservación de especies amenazadas"
"Biología","Participo en programas de rescate de aves en peligro"
"Biología","me gusta la ecología"
"Biología","analizo datos de experimentos"
"Biología","disfruto investigando la fauna marina"
"Biología","realizo estudios de genética"
"Biología","identifico especies de plantas"
"Biología","observo el comportamiento animal"
"Biología","trabajo en laboratorios biológicos"
"Biología","me especializo en biotecnología"
"Biología","participo en investigaciones de campo"
"Biología","me encanta la botánica"
"Biología","estudio la biodiversidad"
"Biología","contribuyo a la conservación de especies"
"Biología","realizo muestreos en ecosistemas"
"Biología","analizo muestras de tejidos"
"Biología","estudio la evolución de las especies"
"Biología","investigo enfermedades en animales"
"Biología","me dedico a la zoología"
"Biología","trabajo en proyectos de restauración ecológica"
"Biología","realizo estudios de anatomía"
"Biología","soy experto en taxonomía"
"Biología","me gusta la biología marina"
"Biología","investigo sobre microbiología"
"Biología","participo en programas de conservación"
"Biología","realizo análisis de suelos"
"Biología","me dedico a la botánica tropical"
"Biología","trabajo con muestras de ADN"
"Biología","exploro la ecología urbana"
"Biología","investigo sobre la fisiología animal"
"Biología","participo en estudios de evolución"
"Biología","realizo análisis de datos genéticos"
"Biología","me especializo en ecología acuática"
"Biología","investigo sobre la conservación de aves"
"Biología","trabajo en la rehabilitación de hábitats"
"Biología","me encanta la investigación científica"
"Biología","estudio la diversidad de insectos"
"Biología","me dedico a la biología molecular"
"Biología","realizo estudios de paleontología"
"Biología","analizo datos de poblaciones animales"
"Biología","me especializo en ecología forestal"
"Biología","investigo sobre la genética de plantas"
"Biología","participo en proyectos de educación ambiental"
"Biología","realizo estudios de comportamiento de mamíferos"
"Biología","me gusta la ecología terrestre"
"Biología","investigo sobre la conservación marina"
"Biología","trabajo en la gestión de áreas protegidas"
"Biología","me dedico a la zoología marina"
"Biología","realizo estudios de biogeografía"
"Biología","analizo datos de secuencias genéticas"
"Biología","estudio la ecología de poblaciones"
"Biología","me especializo en ecología de humedales"
"Biología","investigo sobre la genética de animales"
"Biología","participo en proyectos de restauración de ecosistemas"
"Biología","realizo estudios de ecología molecular"
"Biología","me encanta la investigación en biología acuática"
"Biología","exploro la diversidad de aves"
"Biología","me dedico a la biología de la conservación"
"Biología","trabajo con poblaciones de reptiles"
"Biología","realizo estudios de etología animal"
"Biología","analizo datos de comunidades vegetales"
"Biología","estudio la ecología de insectos"
"Biología","me especializo en ecología de selvas tropicales"
"Biología","investigo sobre la genética de microorganismos"
"Biología","participo en proyectos de recuperación de especies en peligro"
"Biología","realizo estudios de ecología del paisaje"
"Biología","me gusta la biología marina tropical"
"Biología","exploro la diversidad de mamíferos"
"Biología","me dedico a la biología evolutiva"
"Biología","trabajo en la conservación de arrecifes coralinos"
"Biología","realizo estudios de ecología acuática dulceacuícola"
"Biología","analizo datos de dinámica de poblaciones"
"Biología","estudio la ecología de plantas"
"Biología","me especializo en ecología de bosques tropicales"
"Biología","investigo sobre la genética de aves"
"Biología","participo en proyectos de rehabilitación de suelos"
"Biología","realizo estudios de ecología de mamíferos marinos"
"Biología","me encanta la investigación en ecología urbana"
"Biología","exploro la diversidad de reptiles"
"Biología","me dedico a la biología de la conservación marina"
"Biología","trabajo con poblaciones de aves migratorias"
"Biología","realizo estudios de comportamiento de peces"
"Biología","analizo datos de comunidades animales"
"Ciencia de los Alimentos","soy experto en análisis sensorial de alimentos"
"Ciencia de los Alimentos","me gusta la tecnología de alimentos"
"Ciencia de los Alimentos","trabajo en el desarrollo de nuevos productos alimenticios"
"Ciencia de los Alimentos","me gusta investigar sobre nutrición y salud"
"Ciencia de los Alimentos","realizo estudios de calidad de los alimentos"
"Ciencia de los Alimentos","me especializo en procesamiento de lácteos"
"Ciencia de los Alimentos","disfruto formulando recetas innovadoras"
"Ciencia de los Alimentos","analizo la composición nutricional de los alimentos"
"Ciencia de los Alimentos","me encanta estudiar la ciencia detrás de la cocina"
"Ciencia de los Alimentos","participo en investigaciones sobre conservación de alimentos"
"Ciencia de los Alimentos","trabajo en el control de calidad en industrias alimentarias"
"Ciencia de los Alimentos","me dedico a la microbiología alimentaria"
"Ciencia de los Alimentos","realizo estudios de tecnología de cereales"
"Ciencia de los Alimentos","me gusta la seguridad alimentaria"
"Ciencia de los Alimentos","investigo sobre nuevos métodos de conservación de alimentos"
"Ciencia de los Alimentos","trabajo en el desarrollo de alimentos funcionales"
"Ciencia de los Alimentos","me gusta estudiar la ciencia de los sabores"
"Ciencia de los Alimentos","realizo análisis de alimentos para determinar su valor nutricional"
"Ciencia de los Alimentos","me dedico a la investigación de aditivos alimentarios"
"Ciencia de los Alimentos","disfruto innovando en la elaboración de productos horneados"
"Ciencia de los Alimentos","trabajo en el diseño de empaques sostenibles para alimentos"
"Ciencia de los Alimentos","me gusta la química de los alimentos"
"Ciencia de los Alimentos","investigo sobre la influencia de los alimentos en la salud intestinal"
"Ciencia de los Alimentos","realizo estudios de procesamiento de frutas y verduras"
"Ciencia de los Alimentos","me gusta investigar sobre alergenos alimentarios"
"Ciencia de los Alimentos","trabajo en el desarrollo de alimentos enriquecidos"
"Ciencia de los Alimentos","me dedico a la ciencia de los alimentos en el deporte"
"Ciencia de los Alimentos","realizo análisis microbiológicos en alimentos"
"Ciencia de los Alimentos","disfruto creando productos de confitería innovadores"
"Ciencia de los Alimentos","investigo sobre la calidad de los aceites y grasas"
"Ciencia de los Alimentos","me gusta la tecnología de envasado de alimentos"
"Ciencia de los Alimentos","trabajo en el desarrollo de alimentos orgánicos"
"Ciencia de los Alimentos","me gusta estudiar la ciencia detrás de los alimentos fermentados"
"Ciencia de los Alimentos","realizo análisis de textura en productos alimenticios"
"Ciencia de los Alimentos","me dedico a la investigación de alimentos genéticamente modificados"
"Ciencia de los Alimentos","investigo sobre la utilización de subproductos agrícolas en alimentos"
"Ciencia de los Alimentos","trabajo en el desarrollo de alimentos sin gluten"
"Ciencia de los Alimentos","me gusta la ciencia de los alimentos en la industria cárnica"
"Ciencia de los Alimentos","realizo estudios de procesamiento de alimentos acuícolas"
"Ciencia de los Alimentos","me gusta investigar sobre la formulación de alimentos para bebés"
"Ciencia de los Alimentos","trabajo en el desarrollo de alimentos bajos en calorías"
"Ciencia de los Alimentos","me dedico a la investigación de alimentos de origen vegetal"
"Ciencia de los Alimentos","realizo análisis de estabilidad de alimentos"
"Ciencia de los Alimentos","disfruto innovando en la elaboración de alimentos deshidratados"
"Ciencia de los Alimentos","investigo sobre la utilización de alimentos transgénicos"
"Ciencia de los Alimentos","me gusta la ciencia de los alimentos en la industria pesquera"
"Ciencia de los Alimentos","realizo estudios de procesamiento de alimentos lácteos"
"Ciencia de los Alimentos","me gusta investigar sobre la reducción de desperdicios alimentarios"
"Ciencia de los Alimentos","me dedico a la investigación de alimentos funcionales"
"Ciencia de los Alimentos","realizo análisis de contaminantes en alimentos"
"Ciencia de los Alimentos","disfruto innovando en la elaboración de alimentos libres de alérgenos"
"Ciencia de los Alimentos","investigo sobre la utilización de ingredientes naturales en alimentos"
"Ciencia de los Alimentos","trabajo en el desarrollo de alimentos para deportistas"
"Ciencia de los Alimentos","me gusta la ciencia de los alimentos en la industria agrícola"
"Ciencia de los Alimentos","realizo estudios de procesamiento de alimentos cárnicos"
"Ciencia de los Alimentos","me gusta investigar sobre la reducción de azúcares en alimentos"
"Ciencia de los Alimentos","trabajo en el desarrollo de alimentos saludables"
"Ciencia de los Alimentos","Disfruto creando recetas saludables y deliciosas"
"Ciencia de los Alimentos","Investigo sobre nuevos métodos de conservación de alimentos"
"Ciencia de los Alimentos","Me gusta estudiar la nutrición y sus efectos en el cuerpo"
"Ciencia de los Alimentos","Participo en investigaciones sobre la calidad de los alimentos"
"Ciencia de los Alimentos","Me gusta desarrollar productos alimenticios innovadores"
"Ciencia de los Alimentos","Realizo análisis sensoriales para evaluar productos gastronómicos"
"Ciencia de los Alimentos","Exploro la tecnología de alimentos y su aplicación en la industria"
"Ciencia de los Alimentos","Investigo sobre la seguridad alimentaria y sus desafíos"
"Ciencia de los Alimentos","Contribuyo a la creación de etiquetado nutricional claro"
"Ciencia de los Alimentos","Me interesa estudiar los efectos del procesamiento de alimentos"
