"carrera","frase"
"Ciencia de los Alimentos","Participo en el desarrollo de nuevos productos dietéticos"
"Ciencia de los Alimentos","Analizo la composición química de los alimentos"
"Ciencia de los Alimentos","Estudio la microbiología de los procesos alimentarios"
"Ciencia de los Alimentos","Exploro la fermentación y su influencia en los productos"
"Ciencia de los Alimentos","Me gusta investigar sobre la ciencia de la panificación"
"Ciencia de los Alimentos","Contribuyo a la innovación en la industria alimentaria"
"Ciencia de los Alimentos","Investigo sobre el impacto de los aditivos en los alimentos"
"Ciencia de los Alimentos","Participo en estudios de vida útil de los productos alimenticios"
"Ciencia de los Alimentos","Me gusta desarrollar alimentos funcionales y nutracéuticos"
"Ciencia de los Alimentos","Realizo análisis de laboratorio para asegurar la calidad de los productos"
"Ciencia de los Alimentos","Exploro la tecnología de empaquetado de alimentos"
"Ciencia de los Alimentos","Investigo sobre la optimización de procesos en la industria alimentaria"
"Ciencia de los Alimentos","Contribuyo a la reducción del desperdicio alimentario"
"Ciencia de los Alimentos","Participo en investigaciones sobre alergias y intolerancias alimentarias"
"Ciencia de los Alimentos","Me interesa estudiar los aspectos nutricionales de diferentes culturas"
"Ciencia de los Alimentos","Analizo la textura y sabor de los alimentos para mejorarlos"
"Ciencia de los Alimentos","Estudio la química de los procesos de cocción y horneado"
"Ciencia de los Alimentos","Exploro la producción de alimentos orgánicos y sostenibles"
"Ciencia de los Alimentos","Investigo sobre la influencia de la dieta en la salud mental"
"Ciencia de los Alimentos","Contribuyo a la creación de productos para dietas especiales"
"Ciencia de los Alimentos","Participo en proyectos de seguridad alimentaria en comunidades vulnerables"
"Ciencia de los Alimentos","Me gusta desarrollar alternativas saludables a alimentos procesados"
"Ciencia de los Alimentos","Realizo análisis de contenido nutricional en etiquetas de productos"
"Ciencia de los Alimentos","Exploro la tecnología de envasado al vacío de alimentos"
"Ciencia de los Alimentos","Investigo sobre la bioaccesibilidad de nutrientes en alimentos"
"Ciencia de los Alimentos","Contribuyo a la mejora de la calidad de los alimentos infantiles"
"Ciencia de los Alimentos","Participo en estudios de formulación de suplementos nutricionales"
"Ciencia de los Alimentos","Analizo la seguridad y estabilidad de los alimentos envasados"
"Ciencia de los Alimentos","Estudio la influencia de los alimentos en la prevención de enfermedades"
"Ciencia de los Alimentos","Exploro la tecnología de liofilización de alimentos"
"Ciencia de los Alimentos","Investigo sobre el desarrollo de alimentos enriquecidos"
"Ciencia de los Alimentos","Contribuyo a la investigación de alimentos transgénicos"
"Ciencia de los Alimentos","Participo en proyectos de educación nutricional en escuelas"
"Ciencia de los Alimentos","Me gusta crear recetas adaptadas a necesidades específicas"
"Ciencia de los Alimentos","Realizo análisis para detectar contaminantes en los alimentos"
"Ciencia de los Alimentos","Exploro la tecnología de extrusión de alimentos"
"Ciencia de los Alimentos","Investigo sobre la interacción entre dieta y enfermedades crónicas"
"Ciencia de los Alimentos","Contribuyo a la creación de alimentos enriquecidos para deportistas"
"Ciencia de los Alimentos","Participo en estudios de impacto ambiental de la industria alimentaria"
"Ciencia de los Alimentos","Analizo la calidad nutricional de alimentos procesados"
"Ciencia de los Alimentos","Estudio la influencia de la alimentación en el envejecimiento"
"Ciencia de los Alimentos","Exploro la tecnología de extracción de aceites esenciales en alimentos"
"Ciencia de los Alimentos","Investigo sobre el desarrollo de alimentos bajos en sodio"
"Ciencia de los Alimentos","Contribuyo a la promoción de hábitos alimentarios saludables"
"Ciencia de los Alimentos","Participo en proyectos de reducción de azúcares en productos"
"Ciencia de los Alimentos","Me gusta investigar sobre la mejora genética de cultivos alimentarios"
"Física","Me fascina resolver problemas de mecánica clásica"
"Física","Investigo la teoría cuántica y sus aplicaciones"
"Física","Disfruto estudiando la termodinámica y la energía"
"Física","Exploro la física de partículas subatómicas"
"Física","Me gusta analizar sistemas caóticos y fractales"
"Física","Estudio la teoría de la relatividad y sus efectos"
"Física","Investigo sobre la óptica y fenómenos de luz"
"Física","Me gusta modelar sistemas físicos con matemáticas"
"Física","Analizo fenómenos electromagnéticos y sus leyes"
"Física","Exploro la física nuclear y de partículas"
"Física","Investigo sobre la mecánica cuántica y su interpretación"
"Física","Me gusta estudiar el comportamiento de los fluidos"
"Física","Estudio la física de los materiales y sus propiedades"
"Física","Disfruto analizando fenómenos de ondas y vibraciones"
"Física","Exploro la astrofísica y el estudio del universo"
"Física","Investigo sobre la gravedad y la teoría de campo"
"Física","Me gusta estudiar la física aplicada a la medicina"
"Física","Analizo fenómenos de magnetismo y sus efectos"
"Física","Estudio la física de la radiación y sus usos"
"Física","Disfruto investigando sobre la mecánica de fluidos"
"Física","Investigo la teoría del caos y sistemas dinámicos"
"Física","Me gusta la física cuántica y su dualidad"
"Física","Exploro la física de partículas elementales"
"Física","Estudio la termodinámica y sus ciclos de energía"
"Física","Investigo sobre la física de semiconductores"
"Física","Me gusta resolver problemas de mecánica estadística"
"Física","Analizo fenómenos de interferencia y difracción"
"Física","Disfruto estudiando la teoría electromagnética"
"Física","Exploro la física teórica y sus predicciones"
"Física","Investigo sobre la física de la atmósfera"
"Física","Me gusta la física de partículas subatómicas"
"Física","Estudio la teoría de la relatividad y sus postulados"
"Física","Investigo sobre la óptica geométrica y ondulatoria"
"Física","Disfruto modelando sistemas físicos complejos"
"Física","Me gusta estudiar la física de materiales magnéticos"
"Física","Analizo fenómenos de oscilaciones y resonancias"
"Física","Exploro la astrofísica y los fenómenos estelares"
"Física","Investigo sobre la teoría de la relatividad general"
"Física","Me gusta la física aplicada a la ingeniería"
"Física","Estudio la física del transporte y sus leyes"
"Física","Disfruto investigando sobre la física de partículas"
"Física","Exploro la física de la radiactividad y sus efectos"
"Física","Investigo sobre la mecánica clásica y sus principios"
"Física","Me gusta estudiar la física cuántica y sus experimentos"
"Física","Analizo fenómenos de carga eléctrica y magnetismo"
"Física","Estudio la física de la materia condensada"
"Física","Investigo sobre la teoría de la gravitación cuántica"
"Física","Me gusta la física de la propagación de ondas"
"Física","Disfruto modelando sistemas físicos con ecuaciones"
"Física","Exploro la física de partículas y sus interacciones"
"Física","Investigo sobre la teoría de cuerdas y dimensiones"
"Física","Me gusta estudiar la física aplicada a la tecnología"
"Física","Analizo fenómenos de transferencia de calor y masa"
"Física","Estudio la física de la formación de galaxias"
"Física","Disfruto investigando sobre la física nuclear"
"Física","Exploro la física de partículas y sus detectores"
"Física","Investigo sobre la teoría de la relatividad especial"
"Física","Me gusta la física de los fenómenos térmicos"
"Física","Estudio la física de la propagación de luz"
"Física","Disfruto modelando sistemas físicos en simulaciones"
"Física","Analizo fenómenos de electricidad y magnetismo"
"Física","Investigo sobre la física de plasmas y sus aplicaciones"
"Física","Me gusta estudiar la física aplicada a la energía"
"Física","Exploro la física de partículas y sus colisiones"
"Física","me gusta estudiar la mecánica cuántica"
"Física","realizo experimentos en laboratorios de óptica"
"Física","soy experto en análisis de datos astronómicos"
"Física","me gusta resolver problemas de termodinámica"
"Física","trabajo en investigaciones de física de partículas"
"Física","me dedico al estudio de la teoría de la relatividad"
"Física","disfruto investigando la física de fluidos"
"Física","realizo simulaciones de sistemas caóticos"
"Física","me gusta la astrofísica y cosmología"
"Física","estudio las propiedades de los materiales"
"Física","analizo datos de experimentos de física nuclear"
"Física","me gusta investigar sobre la teoría de cuerdas"
"Física","trabajo en el desarrollo de tecnología cuántica"
"Física","me dedico a la investigación de la física de partículas elementales"
"Física","realizo estudios sobre la radiación electromagnética"
"Física","soy experto en mecánica clásica"
"Física","me gusta estudiar el comportamiento de los fluidos"
"Física","investigo sobre la teoría del caos"
"Física","trabajo en proyectos de física experimental"
"Física","me gusta resolver problemas de electromagnetismo"
"Física","realizo simulaciones de sistemas físicos complejos"
"Física","me dedico al estudio de la física teórica"
"Física","disfruto investigando sobre la física cuántica"
"Física","estudio las propiedades ópticas de los materiales"
"Física","analizo datos de experimentos astronómicos"
"Física","me gusta investigar sobre la teoría de la gravitación"
"Física","trabajo en el desarrollo de tecnologías de energía renovable"
"Física","me dedico a la investigación de la teoría de cuerdas"
"Física","realizo estudios sobre la propagación de ondas"
"Física","soy experto en física de partículas subatómicas"
"Física","me gusta estudiar las interacciones electromagnéticas"
"Física","investigo sobre la mecánica estadística"
"Física","trabajo en proyectos de física teórica"
"Física","me gusta resolver problemas de termodinámica cuántica"
"Física","realizo simulaciones de sistemas físicos a gran escala"
"Física","me gusta la investigación de la física de partículas elementales"
"Física","disfruto investigando sobre la teoría del caos"
"Física","estudio las propiedades magnéticas de los materiales"
"Física","analizo datos de experimentos de física de altas energías"
"Física","me gusta investigar sobre la física de la materia condensada"
"Física","trabajo en el desarrollo de tecnologías cuánticas de la información"
"Física","me dedico a la investigación de la teoría cuántica de campos"
"Física","realizo estudios sobre la propagación de ondas electromagnéticas"
"Física","soy experto en física de partículas fundamentales"
"Física","me gusta estudiar la óptica cuántica"
"Física","investigo sobre la teoría de la relatividad general"
"Física","trabajo en proyectos de física de altas energías"
"Física","me gusta resolver problemas de mecánica cuántica"
"Física","realizo simulaciones de sistemas caóticos y no lineales"
"Física","me dedico a la investigación de la física nuclear"
"Física","disfruto investigando sobre la física de partículas subatómicas"
"Física","estudio las propiedades térmicas de los materiales"
"Física","analizo datos de experimentos de física de partículas"
"Física","me gusta investigar sobre la teoría de la relatividad especial"
"Física","trabajo en el desarrollo de tecnología de energía nuclear"
"Física","me dedico a la investigación de la física de plasmas"
"Física","realizo estudios sobre la propagación de ondas mecánicas"
"Física","soy experto en física teórica de partículas"
"Física","me gusta estudiar la física de sistemas complejos"
"Física","investigo sobre la teoría de la gravedad cuántica"
"Física","trabajo en proyectos de física estadística"
"Física","me gusta resolver problemas de electromagnetismo cuántico"
"Física","realizo simulaciones de sistemas de materia condensada"
"Física","disfruto investigando sobre la física del estado sólido"
"Física","estudio las propiedades eléctricas de los materiales"
"Matemáticas","me gusta resolver problemas matemáticos complejos"
"Matemáticas","soy experto en cálculo y análisis matemático"
"Matemáticas","disfruto investigar sobre teoría de números"
"Matemáticas","realizo estudios de álgebra abstracta"
"Matemáticas","me gusta aplicar estadísticas en la investigación"
"Matemáticas","trabajo en proyectos de geometría diferencial"
"Matemáticas","me dedico a la teoría de probabilidad y estadística"
"Matemáticas","estudio la teoría de conjuntos y lógica matemática"
"Matemáticas","investigo sobre ecuaciones diferenciales y análisis numérico"
"Matemáticas","realizo estudios en topología y teoría de grafos"
"Matemáticas","me gusta resolver problemas de optimización"
"Matemáticas","soy experto en teoría del caos y sistemas dinámicos"
"Matemáticas","disfruto investigar sobre teoría de grupos"
"Matemáticas","trabajo en proyectos de criptografía y seguridad"
"Matemáticas","me dedico a la teoría de juegos y optimización combinatoria"
"Matemáticas","estudio la geometría algebraica y teoría de números"
"Matemáticas","investigo sobre análisis armónico y transformadas"
"Matemáticas","realizo estudios de probabilidad y procesos estocásticos"
"Matemáticas","me gusta aplicar estadísticas en la investigación científica"
"Matemáticas","soy experto en cálculo vectorial y teoría de medida"
"Matemáticas","disfruto investigar sobre teoría de la complejidad computacional"
"Matemáticas","trabajo en proyectos de teoría de grafos y redes"
"Matemáticas","me dedico a la teoría de números y criptografía"
"Matemáticas","estudio la lógica matemática y teoría de conjuntos"
"Matemáticas","investigo sobre geometría diferencial y análisis funcional"
"Matemáticas","realizo estudios en teoría de la información y codificación"
"Matemáticas","me gusta resolver problemas de análisis complejo"
"Matemáticas","soy experto en teoría de representación y álgebra lineal"
"Matemáticas","disfruto investigar sobre teoría de autómatas y lenguajes formales"
"Matemáticas","trabajo en proyectos de teoría de números y combinatoria"
"Matemáticas","Me gusta resolver problemas matemáticos complejos"
"Matemáticas","Investigo sobre teoría de números y sus propiedades"
"Matemáticas","Disfruto analizando sistemas algebraicos abstractos"
"Matemáticas","Exploro la geometría y sus aplicaciones prácticas"
"Matemáticas","Me gusta estudiar análisis matemático y sus convergencias"
"Matemáticas","Realizo investigaciones sobre estadísticas y probabilidades"
"Matemáticas","Investigo sobre topología y sus transformaciones"
"Matemáticas","Estudio la teoría de conjuntos y sus operaciones"
"Matemáticas","Analizo ecuaciones diferenciales y sus soluciones"
"Matemáticas","Me gusta la lógica matemática y sus fundamentos"
"Matemáticas","Exploro la teoría de grafos y sus representaciones"
"Matemáticas","Disfruto investigando sobre cálculo integral y sus aplicaciones"
"Matemáticas","Me gusta modelar sistemas matemáticos con ecuaciones"
"Matemáticas","Estudio la combinatoria y sus permutaciones"
"Matemáticas","Investigo sobre álgebra lineal y sus transformaciones"
"Matemáticas","Realizo análisis numérico y métodos aproximados"
"Matemáticas","Exploro la teoría de la probabilidad y sus eventos"
"Matemáticas","Me gusta resolver problemas de optimización matemática"
"Matemáticas","Investigo sobre lógica simbólica y sus demostraciones"
"Matemáticas","Disfruto estudiando la teoría de grupos y sus propiedades"
"Matemáticas","Estudio la teoría de conjuntos y sus operaciones"
"Matemáticas","Analizo ecuaciones diferenciales y sus soluciones"
"Matemáticas","Me gusta la estadística y sus aplicaciones en el análisis de datos"
"Matemáticas","Exploro la geometría y sus aplicaciones en el diseño"
"Matemáticas","Disfruto investigando sobre teoría de números y criptografía"
"Matemáticas","Me gusta resolver problemas de álgebra abstracta"
"Matemáticas","Investigo sobre teoría de probabilidades y distribuciones"
"Matemáticas","Estudio el análisis complejo y sus funciones"
"Matemáticas","Realizo investigaciones sobre teoría de juegos y estrategias"
"Matemáticas","Exploro la geometría diferencial y sus curvas"
"Matemáticas","Me gusta la teoría de conjuntos y sus axiomas"
"Matemáticas","Investigo sobre teoría de números y propiedades de divisibilidad"
"Matemáticas","Disfruto analizando sistemas matemáticos en forma matricial"
"Matemáticas","Estudio la topología y sus transformaciones en espacios"
"Matemáticas","Me gusta investigar sobre la teoría de grafos y conectividad"
"Matemáticas","Realizo análisis de ecuaciones diferenciales y sus soluciones"
"Matemáticas","Exploro la estadística y sus métodos de inferencia"
"Matemáticas","Investigo sobre teoría del caos y sistemas dinámicos"
"Matemáticas","Estudio la geometría proyectiva y sus propiedades"
"Matemáticas","Disfruto resolviendo problemas de lógica matemática"
"Matemáticas","Me gusta analizar sistemas matemáticos con ecuaciones diferenciales"
"Matemáticas","Investigo sobre teoría de números y propiedades de primos"
"Matemáticas","Exploro la teoría de conjuntos y sus operaciones lógicas"
"Matemáticas","Realizo análisis estadístico y modelos de regresión"
"Matemáticas","Me gusta estudiar el álgebra lineal y sus aplicaciones"
"Matemáticas","Estudio la geometría euclidiana y sus axiomas"
"Matemáticas","Disfruto investigando sobre cálculo multivariable y sus gradientes"
"Matemáticas","Exploro la teoría de números y sus propiedades aritméticas"
"Matemáticas","Investigo sobre teoría de probabilidad y distribuciones estadísticas"
"Matemáticas","Me gusta resolver problemas de ecuaciones diferenciales y sus soluciones"
"Matemáticas","Realizo análisis de datos estadísticos y modelos predictivos"
"Matemáticas","Estudio la topología y sus espacios topológicos"
"Matemáticas","Disfruto investigando sobre teoría de grafos y conectividad de nodos"
"Matemáticas","Me gusta estudiar el álgebra abstracta y sus estructuras"
"Matemáticas","Exploro la geometría y sus aplicaciones en la arquitectura"
"Matemáticas","Investigo sobre la teoría de conjuntos y sus axiomas"
"Matemáticas","Estudio la estadística y sus métodos de inferencia"
"Matemáticas","Disfruto analizando sistemas matemáticos en forma matricial"
"Matemáticas","Me gusta investigar sobre teoría de números y propiedades de divisibilidad"
"Matemáticas","Realizo análisis de ecuaciones diferenciales y sus soluciones"
"Matemáticas","Exploro la geometría diferencial y sus curvas"
"Matemáticas","Investigo sobre teoría de juegos y estrategias"
"Matemáticas","Me gusta la teoría de conjuntos y sus axiomas"
"Matemáticas","Disfruto estudiando el análisis complejo y sus funciones"
"Matemáticas","Estudio la topología y sus transformaciones en espacios"
"Matemáticas","Exploro la geometría y sus aplicaciones en el diseño"
"Matemáticas","Investigo sobre teoría de números y criptografía"
"Matemáticas","Me gusta resolver problemas de álgebra abstracta"
"Matemáticas","Analizo sistemas matemáticos con ecuaciones diferenciales"
"Matemáticas","Realizo investigaciones sobre teoría de grafos y conectividad"
"Matemáticas","Exploro la geometría proyectiva y sus propiedades"
"Matemáticas","Me gusta la lógica matemática y sus fundamentos"
"Matemáticas","Investigo sobre teoría de números y sus propiedades"
"Matemáticas","Disfruto analizando sistemas algebraicos abstractos"
"Matemáticas","Estudio la geometría y sus aplicaciones prácticas"
"Matemáticas","Me gusta estudiar análisis matemático y sus convergencias"
"Matemáticas","Realizo investigaciones sobre estadísticas y probabilidades"
"Matemáticas","Investigo sobre topología y sus transformaciones"
"Matemáticas","Estudio la teoría de conjuntos y sus operaciones"
"Matemáticas","Analizo ecuaciones diferenciales y sus soluciones"
"Matemáticas","Me gusta la lógica matemática y sus fundamentos"
"Química","Me gusta realizar experimentos en el laboratorio"
"Química","Investigo sobre reacciones químicas y sus cinéticas"
"Química","Disfruto analizando la estructura de moléculas"
"Química","Exploro la química orgánica y sus compuestos"
"Química","Me gusta estudiar la tabla periódica y sus elementos"
"Química","Realizo investigaciones sobre la síntesis de nuevos materiales"
"Química","Investigo sobre la química inorgánica y sus propiedades"
"Química","Estudio la termodinámica química y sus cambios de energía"
"Química","Analizo la química analítica y sus métodos de medición"
"Química","Me gusta investigar sobre la química ambiental"
"Química","Exploro la bioquímica y sus procesos celulares"
"Química","Investigo sobre la química física y sus leyes"
"Química","Disfruto estudiando la espectroscopía y sus aplicaciones"
"Química","Me gusta analizar la cinética de reacciones químicas"
"Química","Realizo investigaciones sobre la química teórica"
"Química","Investigo sobre la química de materiales y sus propiedades"
"Química","Estudio la catálisis y sus aplicaciones industriales"
"Química","Analizo la química cuántica y sus fundamentos"
"Química","Me gusta estudiar la química forense y sus análisis"
"Química","Exploro la nanotecnología y sus aplicaciones químicas"
"Química","Investigo sobre la química de polímeros y sus usos"
"Química","Disfruto analizando la química de los alimentos"
"Química","Me gusta estudiar la química farmacéutica y sus compuestos"
"Química","Realizo investigaciones sobre la química de la atmósfera"
"Química","Investigo sobre la química de superficies y sus interacciones"
"Química","Estudio la electroquímica y sus aplicaciones en baterías"
"Química","Analizo la química de los combustibles y su eficiencia"
"Química","Me gusta investigar sobre la química de los metales"
"Química","Exploro la química de productos naturales y sus beneficios"
"Química","Investigo sobre la química nuclear y sus reacciones"
"Química","Disfruto estudiando la química de productos químicos industriales"
"Química","Me gusta analizar la química del suelo y sus componentes"
"Química","Realizo investigaciones sobre la química de los poluentes"
"Química","Investigo sobre la química de materiales poliméricos"
"Química","Estudio la química de los materiales magnéticos"
"Química","Analizo la química de los compuestos aromáticos"
"Química","Me gusta investigar sobre la química de los productos de limpieza"
"Química","Exploro la química de los alimentos y sus aditivos"
"Química","Investigo sobre la química de los elementos de transición"
"Química","Disfruto estudiando la química de los materiales cerámicos"
"Química","Me gusta analizar la química de los productos cosméticos"
"Química","Realizo investigaciones sobre la química de los materiales compuestos"
"Química","Investigo sobre la química de los productos de cuidado personal"
"Química","Estudio la química de los materiales electrónicos"
"Química","Analizo la química de los compuestos organometálicos"
"Química","Me gusta investigar sobre la química de los plásticos"
"Química","Exploro la química de los productos de limpieza del hogar"
"Química","Investigo sobre la química de los productos farmacéuticos"
"Química","Disfruto estudiando la química de los materiales biomédicos"
"Química","Me gusta analizar la química de los productos agrícolas"
"Química","Realizo investigaciones sobre la química de los materiales metálicos"
"Química","Investigo sobre la química de los productos químicos tóxicos"
"Química","Estudio la química de los materiales conductores"
"Química","Analizo la química de los compuestos heterocíclicos"
"Química","Me gusta investigar sobre la química de los productos de higiene"
"Química","Exploro la química de los productos alimenticios procesados"
"Química","Investigo sobre la química de los materiales poliméricos"
"Química","Disfruto estudiando la química de los productos de belleza"
"Química","Me gusta analizar la química de los productos de limpieza industrial"
"Química","Realizo investigaciones sobre la química de los productos químicos industriales"
"Química","Investigo sobre la química de los materiales compuestos"
"Química","me gusta analizar compuestos químicos"
"Química","trabajo en laboratorios realizando experimentos"
"Química","soy experto en síntesis de moléculas"
"Química","disfruto investigando sobre reacciones químicas"
"Química","me dedico a estudiar la química orgánica"
"Química","realizo análisis de muestras en equipos especializados"
"Química","me gusta estudiar la química inorgánica"
"Química","participo en investigaciones sobre nanomateriales"
"Química","trabajo en la industria farmacéutica"
"Química","me gusta la química analítica"
"Química","realizo estudios sobre la cinética química"
"Química","investigo sobre materiales poliméricos"
"Química","me dedico a la química física"
"Química","soy experto en espectroscopía molecular"
"Química","disfruto investigando sobre la química ambiental"
"Química","trabajo en la investigación de nuevos materiales"
"Química","me gusta estudiar la química de los alimentos"
"Química","realizo análisis de aguas y suelos"
"Química","participo en proyectos de energías renovables"
"Química","me gusta la química teórica"
"Química","investigo sobre la catálisis y reactores químicos"
